[2026-01-24 07:41:01] 07:41:01.659375 eth0  In  IP 172.20.0.1.35416 > 172.20.0.10.80: Flags [S], seq 1348034857, win 65495, options [mss 65495,sackOK,TS val 1744399310 ecr 0,nop,wscale 7], length 0
[2026-01-24 07:41:02] 07:41:02.681644 eth0  In  IP 172.20.0.1.35416 > 172.20.0.10.80: Flags [S], seq 1348034857, win 65495, options [mss 65495,sackOK,TS val 1744400333 ecr 0,nop,wscale 7], length 0
[2026-01-24 07:41:03] 07:41:03.709760 eth0  In  IP 172.20.0.1.35416 > 172.20.0.10.80: Flags [S], seq 1348034857, win 65495, options [mss 65495,sackOK,TS val 1744401361 ecr 0,nop,wscale 7], length 0
[2026-01-24 07:41:04] 07:41:04.729752 eth0  In  IP 172.20.0.1.35416 > 172.20.0.10.80: Flags [S], seq 1348034857, win 65495, options [mss 65495,sackOK,TS val 1744402381 ecr 0,nop,wscale 7], length 0
[2026-01-24 07:45:40] 07:45:40.291714 eth0  In  IP 172.20.0.1.37146 > 172.20.0.10.80: Flags [S], seq 4022372494, win 65495, options [mss 65495,sackOK,TS val 1744677971 ecr 0,nop,wscale 7], length 0
[2026-01-24 07:45:41] 07:45:41.308891 eth0  In  IP 172.20.0.1.37146 > 172.20.0.10.80: Flags [S], seq 4022372494, win 65495, options [mss 65495,sackOK,TS val 1744678989 ecr 0,nop,wscale 7], length 0
[2026-01-24 07:45:42] 07:45:42.332967 eth0  In  IP 172.20.0.1.37146 > 172.20.0.10.80: Flags [S], seq 4022372494, win 65495, options [mss 65495,sackOK,TS val 1744680013 ecr 0,nop,wscale 7], length 0
[2026-01-24 07:45:43] 07:45:43.361280 eth0  In  IP 172.20.0.1.37146 > 172.20.0.10.80: Flags [S], seq 4022372494, win 65495, options [mss 65495,sackOK,TS val 1744681041 ecr 0,nop,wscale 7], length 0
[2026-01-24 07:45:49] 07:45:49.346764 eth0  In  IP 172.20.0.1.58274 > 172.20.0.10.80: Flags [S], seq 2049496699, win 65495, options [mss 65495,sackOK,TS val 1744687026 ecr 0,nop,wscale 7], length 0
[2026-01-24 07:45:50] 07:45:50.368940 eth0  In  IP 172.20.0.1.58274 > 172.20.0.10.80: Flags [S], seq 2049496699, win 65495, options [mss 65495,sackOK,TS val 1744688049 ecr 0,nop,wscale 7], length 0
[2026-01-24 07:45:51] 07:45:51.385665 eth0  In  IP 172.20.0.1.58274 > 172.20.0.10.80: Flags [S], seq 2049496699, win 65495, options [mss 65495,sackOK,TS val 1744689069 ecr 0,nop,wscale 7], length 0
[2026-01-24 07:45:52] 07:45:52.413490 eth0  In  IP 172.20.0.1.58274 > 172.20.0.10.80: Flags [S], seq 2049496699, win 65495, options [mss 65495,sackOK,TS val 1744690097 ecr 0,nop,wscale 7], length 0
[2026-01-24 07:45:52] 07:45:52.747881 eth0  Out IP 172.20.0.10.80 > 172.20.0.1.58274: Flags [R.], seq 0, ack 2049496700, win 0, length 0
[2026-01-24 07:45:58] 07:45:58.292503 eth0  In  IP 172.20.0.1.46022 > 172.20.0.10.80: Flags [S], seq 2829436309, win 65495, options [mss 65495,sackOK,TS val 1744695976 ecr 0,nop,wscale 7], length 0
[2026-01-24 07:45:58] 07:45:58.292624 eth0  Out IP 172.20.0.10.80 > 172.20.0.1.46022: Flags [S.], seq 4289997859, ack 2829436310, win 65160, options [mss 1460,sackOK,TS val 1511436588 ecr 1744695976,nop,wscale 7], length 0
[2026-01-24 07:45:58] 07:45:58.292641 eth0  In  IP 172.20.0.1.46022 > 172.20.0.10.80: Flags [.], ack 1, win 512, options [nop,nop,TS val 1744695976 ecr 1511436588], length 0
[2026-01-24 07:45:58] 07:45:58.294203 eth0  In  IP 172.20.0.1.46022 > 172.20.0.10.80: Flags [P.], seq 1:816, ack 1, win 512, options [nop,nop,TS val 1744695977 ecr 1511436588], length 815: HTTP: GET /_nicegui_ws/socket.io/?client_id=3d352495-0a8b-48d9-acda-76def93c8996&next_message_id=0&EIO=4&transport=websocket HTTP/1.1
[2026-01-24 07:45:58] 07:45:58.294262 eth0  Out IP 172.20.0.10.80 > 172.20.0.1.46022: Flags [.], ack 816, win 503, options [nop,nop,TS val 1511436589 ecr 1744695977], length 0
[2026-01-24 07:45:58] 07:45:58.298385 eth0  Out IP 172.20.0.10.80 > 172.20.0.1.46022: Flags [P.], seq 1:257, ack 816, win 503, options [nop,nop,TS val 1511436594 ecr 1744695977], length 256: HTTP: HTTP/1.1 101 Switching Protocols
[2026-01-24 07:45:58] 07:45:58.298459 eth0  In  IP 172.20.0.1.46022 > 172.20.0.10.80: Flags [.], ack 257, win 510, options [nop,nop,TS val 1744695982 ecr 1511436594], length 0
[2026-01-24 07:45:58] 07:45:58.298877 eth0  Out IP 172.20.0.10.80 > 172.20.0.1.46022: Flags [P.], seq 257:353, ack 816, win 503, options [nop,nop,TS val 1511436594 ecr 1744695982], length 96: HTTP
[2026-01-24 07:45:58] 07:45:58.298911 eth0  In  IP 172.20.0.1.46022 > 172.20.0.10.80: Flags [.], ack 353, win 510, options [nop,nop,TS val 1744695982 ecr 1511436594], length 0
[2026-01-24 07:45:58] 07:45:58.306132 eth0  In  IP 172.20.0.1.46022 > 172.20.0.10.80: Flags [P.], seq 816:826, ack 353, win 512, options [nop,nop,TS val 1744695989 ecr 1511436594], length 10: HTTP
[2026-01-24 07:45:58] 07:45:58.307572 eth0  Out IP 172.20.0.10.80 > 172.20.0.1.46022: Flags [P.], seq 353:382, ack 826, win 503, options [nop,nop,TS val 1511436603 ecr 1744695989], length 29: HTTP
[2026-01-24 07:45:58] 07:45:58.310288 eth0  In  IP 172.20.0.1.46022 > 172.20.0.10.80: Flags [P.], seq 826:987, ack 382, win 512, options [nop,nop,TS val 1744695993 ecr 1511436603], length 161: HTTP
[2026-01-24 07:45:58] 07:45:58.311093 eth0  Out IP 172.20.0.10.80 > 172.20.0.1.46022: Flags [P.], seq 382:396, ack 987, win 502, options [nop,nop,TS val 1511436606 ecr 1744695993], length 14: HTTP
[2026-01-24 07:45:58] 07:45:58.353425 eth0  In  IP 172.20.0.1.46022 > 172.20.0.10.80: Flags [.], ack 396, win 512, options [nop,nop,TS val 1744696037 ecr 1511436606], length 0
[2026-01-24 07:45:58] 07:45:58.434394 eth0  In  IP 172.20.0.1.46034 > 172.20.0.10.80: Flags [S], seq 2313575831, win 65495, options [mss 65495,sackOK,TS val 1744696118 ecr 0,nop,wscale 7], length 0
[2026-01-24 07:45:58] 07:45:58.435115 eth0  Out IP 172.20.0.10.80 > 172.20.0.1.46034: Flags [S.], seq 1095317827, ack 2313575832, win 65160, options [mss 1460,sackOK,TS val 1511436730 ecr 1744696118,nop,wscale 7], length 0
[2026-01-24 07:45:58] 07:45:58.435145 eth0  In  IP 172.20.0.1.46034 > 172.20.0.10.80: Flags [.], ack 1, win 512, options [nop,nop,TS val 1744696118 ecr 1511436730], length 0
[2026-01-24 07:45:58] 07:45:58.435768 eth0  In  IP 172.20.0.1.46048 > 172.20.0.10.80: Flags [S], seq 4052780053, win 65495, options [mss 65495,sackOK,TS val 1744696119 ecr 0,nop,wscale 7], length 0
[2026-01-24 07:45:58] 07:45:58.435861 eth0  Out IP 172.20.0.10.80 > 172.20.0.1.46048: Flags [S.], seq 2540610641, ack 4052780054, win 65160, options [mss 1460,sackOK,TS val 1511436731 ecr 1744696119,nop,wscale 7], length 0
[2026-01-24 07:45:58] 07:45:58.435883 eth0  In  IP 172.20.0.1.46048 > 172.20.0.10.80: Flags [.], ack 1, win 512, options [nop,nop,TS val 1744696119 ecr 1511436731], length 0
[2026-01-24 07:45:58] 07:45:58.436179 eth0  In  IP 172.20.0.1.46048 > 172.20.0.10.80: Flags [P.], seq 1:931, ack 1, win 512, options [nop,nop,TS val 1744696119 ecr 1511436731], length 930: HTTP: GET /products HTTP/1.1
[2026-01-24 07:45:58] 07:45:58.436214 eth0  Out IP 172.20.0.10.80 > 172.20.0.1.46048: Flags [.], ack 931, win 513, options [nop,nop,TS val 1511436731 ecr 1744696119], length 0
[2026-01-24 07:45:58] 07:45:58.539452 eth0  In  IP 172.20.0.30.56466 > 172.20.0.10.8888: Flags [S], seq 3520082588, win 64240, options [mss 1460,sackOK,TS val 1511436835 ecr 0,nop,wscale 7], length 0
[2026-01-24 07:45:58] 07:45:58.539905 eth0  Out IP 172.20.0.10.8888 > 172.20.0.30.56466: Flags [S.], seq 3122015159, ack 3520082589, win 65160, options [mss 1460,sackOK,TS val 1365000158 ecr 1511436835,nop,wscale 7], length 0
[2026-01-24 07:45:59] 07:45:58.539947 eth0  In  IP 172.20.0.30.56466 > 172.20.0.10.8888: Flags [.], ack 1, win 502, options [nop,nop,TS val 1511436835 ecr 1365000158], length 0
[2026-01-24 07:45:59] 07:45:58.542941 eth0  In  IP 172.20.0.30.56466 > 172.20.0.10.8888: Flags [P.], seq 1:155, ack 1, win 502, options [nop,nop,TS val 1511436838 ecr 1365000158], length 154
[2026-01-24 07:45:59] 07:45:58.543034 eth0  Out IP 172.20.0.10.8888 > 172.20.0.30.56466: Flags [.], ack 155, win 508, options [nop,nop,TS val 1365000161 ecr 1511436838], length 0
[2026-01-24 07:45:59] 07:45:58.606034 eth0  Out IP 172.20.0.10.8888 > 172.20.0.30.56466: Flags [P.], seq 1:3485, ack 155, win 508, options [nop,nop,TS val 1365000224 ecr 1511436838], length 3484
[2026-01-24 07:45:59] 07:45:58.606105 eth0  In  IP 172.20.0.30.56466 > 172.20.0.10.8888: Flags [.], ack 3485, win 557, options [nop,nop,TS val 1511436901 ecr 1365000224], length 0
[2026-01-24 07:45:59] 07:45:58.610664 eth0  In  IP 172.20.0.30.56466 > 172.20.0.10.8888: Flags [F.], seq 155, ack 3485, win 557, options [nop,nop,TS val 1511436906 ecr 1365000224], length 0
[2026-01-24 07:45:59] 07:45:58.610808 eth0  Out IP 172.20.0.10.8888 > 172.20.0.30.56466: Flags [F.], seq 3485, ack 156, win 508, options [nop,nop,TS val 1365000229 ecr 1511436906], length 0
[2026-01-24 07:45:59] 07:45:58.610842 eth0  In  IP 172.20.0.30.56466 > 172.20.0.10.8888: Flags [.], ack 3486, win 557, options [nop,nop,TS val 1511436906 ecr 1365000229], length 0
[2026-01-24 07:45:59] 07:45:58.757045 eth0  Out IP 172.20.0.10.80 > 172.20.0.1.46048: Flags [P.], seq 1:403, ack 931, win 513, options [nop,nop,TS val 1511437052 ecr 1744696119], length 402: HTTP: HTTP/1.1 200 OK
[2026-01-24 07:45:59] 07:45:58.757174 eth0  In  IP 172.20.0.1.46048 > 172.20.0.10.80: Flags [.], ack 403, win 509, options [nop,nop,TS val 1744696440 ecr 1511437052], length 0
[2026-01-24 07:45:59] 07:45:58.757549 eth0  Out IP 172.20.0.10.80 > 172.20.0.1.46048: Flags [P.], seq 403:6165, ack 931, win 513, options [nop,nop,TS val 1511437053 ecr 1744696440], length 5762: HTTP
[2026-01-24 07:45:59] 07:45:58.757599 eth0  In  IP 172.20.0.1.46048 > 172.20.0.10.80: Flags [.], ack 6165, win 840, options [nop,nop,TS val 1744696441 ecr 1511437053], length 0
[2026-01-24 07:45:59] 07:45:58.810034 eth0  In  IP 172.20.0.1.46022 > 172.20.0.10.80: Flags [P.], seq 987:995, ack 396, win 512, options [nop,nop,TS val 1744696493 ecr 1511436606], length 8: HTTP
[2026-01-24 07:45:59] 07:45:58.810567 eth0  In  IP 172.20.0.1.46022 > 172.20.0.10.80: Flags [F.], seq 995, ack 396, win 512, options [nop,nop,TS val 1744696494 ecr 1511436606], length 0
[2026-01-24 07:45:59] 07:45:58.810649 eth0  Out IP 172.20.0.10.80 > 172.20.0.1.46022: Flags [P.], seq 396:400, ack 996, win 502, options [nop,nop,TS val 1511437106 ecr 1744696493], length 4: HTTP
[2026-01-24 07:45:59] 07:45:58.810781 eth0  In  IP 172.20.0.1.46022 > 172.20.0.10.80: Flags [.], ack 400, win 512, options [nop,nop,TS val 1744696494 ecr 1511437106], length 0
[2026-01-24 07:45:59] 07:45:58.810938 eth0  Out IP 172.20.0.10.80 > 172.20.0.1.46022: Flags [F.], seq 400, ack 996, win 502, options [nop,nop,TS val 1511437106 ecr 1744696494], length 0
[2026-01-24 07:45:59] 07:45:58.811034 eth0  In  IP 172.20.0.1.46022 > 172.20.0.10.80: Flags [.], ack 401, win 512, options [nop,nop,TS val 1744696494 ecr 1511437106], length 0
[2026-01-24 07:45:59] 07:45:59.427470 eth0  In  IP 172.20.0.1.46050 > 172.20.0.10.80: Flags [S], seq 3009610457, win 65495, options [mss 65495,sackOK,TS val 1744697111 ecr 0,nop,wscale 7], length 0
[2026-01-24 07:45:59] 07:45:59.427596 eth0  Out IP 172.20.0.10.80 > 172.20.0.1.46050: Flags [S.], seq 1498268510, ack 3009610458, win 65160, options [mss 1460,sackOK,TS val 1511437723 ecr 1744697111,nop,wscale 7], length 0
[2026-01-24 07:45:59] 07:45:59.427618 eth0  In  IP 172.20.0.1.46050 > 172.20.0.10.80: Flags [.], ack 1, win 512, options [nop,nop,TS val 1744697111 ecr 1511437723], length 0
[2026-01-24 07:45:59] 07:45:59.428084 eth0  In  IP 172.20.0.1.46050 > 172.20.0.10.80: Flags [P.], seq 1:816, ack 1, win 512, options [nop,nop,TS val 1744697111 ecr 1511437723], length 815: HTTP: GET /_nicegui_ws/socket.io/?client_id=d70e7e39-dac7-4e6c-9e83-ef663bd39b03&next_message_id=0&EIO=4&transport=websocket HTTP/1.1
[2026-01-24 07:45:59] 07:45:59.428123 eth0  Out IP 172.20.0.10.80 > 172.20.0.1.46050: Flags [.], ack 816, win 503, options [nop,nop,TS val 1511437723 ecr 1744697111], length 0
[2026-01-24 07:45:59] 07:45:59.429999 eth0  Out IP 172.20.0.10.80 > 172.20.0.1.46050: Flags [P.], seq 1:257, ack 816, win 503, options [nop,nop,TS val 1511437725 ecr 1744697111], length 256: HTTP: HTTP/1.1 101 Switching Protocols
[2026-01-24 07:45:59] 07:45:59.430071 eth0  In  IP 172.20.0.1.46050 > 172.20.0.10.80: Flags [.], ack 257, win 510, options [nop,nop,TS val 1744697113 ecr 1511437725], length 0
[2026-01-24 07:45:59] 07:45:59.430442 eth0  Out IP 172.20.0.10.80 > 172.20.0.1.46050: Flags [P.], seq 257:354, ack 816, win 503, options [nop,nop,TS val 1511437726 ecr 1744697113], length 97: HTTP
[2026-01-24 07:45:59] 07:45:59.430499 eth0  In  IP 172.20.0.1.46050 > 172.20.0.10.80: Flags [.], ack 354, win 510, options [nop,nop,TS val 1744697114 ecr 1511437726], length 0
[2026-01-24 07:45:59] 07:45:59.834372 eth0  In  IP 172.20.0.1.46050 > 172.20.0.10.80: Flags [P.], seq 816:826, ack 354, win 512, options [nop,nop,TS val 1744697518 ecr 1511437726], length 10: HTTP
[2026-01-24 07:45:59] 07:45:59.842120 eth0  Out IP 172.20.0.10.80 > 172.20.0.1.46050: Flags [P.], seq 354:383, ack 826, win 503, options [nop,nop,TS val 1511438137 ecr 1744697518], length 29: HTTP
[2026-01-24 07:45:59] 07:45:59.842158 eth0  In  IP 172.20.0.1.46050 > 172.20.0.10.80: Flags [.], ack 383, win 512, options [nop,nop,TS val 1744697525 ecr 1511438137], length 0
[2026-01-24 07:45:59] 07:45:59.881422 eth0  In  IP 172.20.0.1.46050 > 172.20.0.10.80: Flags [P.], seq 826:987, ack 383, win 512, options [nop,nop,TS val 1744697565 ecr 1511438137], length 161: HTTP
[2026-01-24 07:46:00] 07:45:59.883326 eth0  Out IP 172.20.0.10.80 > 172.20.0.1.46050: Flags [P.], seq 383:396, ack 987, win 502, options [nop,nop,TS val 1511438178 ecr 1744697565], length 13: HTTP
[2026-01-24 07:46:00] 07:45:59.883367 eth0  In  IP 172.20.0.1.46050 > 172.20.0.10.80: Flags [.], ack 396, win 512, options [nop,nop,TS val 1744697567 ecr 1511438178], length 0
[2026-01-24 07:46:02] 07:46:02.286926 eth0  In  IP 172.20.0.1.46050 > 172.20.0.10.80: Flags [P.], seq 987:1007, ack 396, win 512, options [nop,nop,TS val 1744699970 ecr 1511438178], length 20: HTTP
[2026-01-24 07:46:02] 07:46:02.333438 eth0  Out IP 172.20.0.10.80 > 172.20.0.1.46050: Flags [.], ack 1007, win 502, options [nop,nop,TS val 1511440629 ecr 1744699970], length 0
[2026-01-24 07:46:03] 07:46:03.430789 eth0  Out IP 172.20.0.10.80 > 172.20.0.1.46050: Flags [P.], seq 396:401, ack 1007, win 502, options [nop,nop,TS val 1511441726 ecr 1744699970], length 5: HTTP
[2026-01-24 07:46:03] 07:46:03.430862 eth0  In  IP 172.20.0.1.46050 > 172.20.0.10.80: Flags [.], ack 401, win 512, options [nop,nop,TS val 1744701114 ecr 1511441726], length 0
[2026-01-24 07:46:03] 07:46:03.432120 eth0  In  IP 172.20.0.1.46050 > 172.20.0.10.80: Flags [P.], seq 1007:1016, ack 401, win 512, options [nop,nop,TS val 1744701115 ecr 1511441726], length 9: HTTP
[2026-01-24 07:46:03] 07:46:03.432191 eth0  Out IP 172.20.0.10.80 > 172.20.0.1.46050: Flags [.], ack 1016, win 502, options [nop,nop,TS val 1511441727 ecr 1744701115], length 0
[2026-01-24 07:46:03] 07:46:03.758161 eth0  Out IP 172.20.0.10.80 > 172.20.0.1.46048: Flags [F.], seq 6165, ack 931, win 513, options [nop,nop,TS val 1511442053 ecr 1744696441], length 0
[2026-01-24 07:46:03] 07:46:03.758557 eth0  In  IP 172.20.0.1.46048 > 172.20.0.10.80: Flags [F.], seq 931, ack 6166, win 840, options [nop,nop,TS val 1744701442 ecr 1511442053], length 0
[2026-01-24 07:46:03] 07:46:03.758620 eth0  Out IP 172.20.0.10.80 > 172.20.0.1.46048: Flags [.], ack 932, win 513, options [nop,nop,TS val 1511442054 ecr 1744701442], length 0
[2026-01-24 07:46:06] 07:46:06.188738 eth0  In  IP 172.20.0.1.46034 > 172.20.0.10.80: Flags [F.], seq 1, ack 1, win 512, options [nop,nop,TS val 1744703872 ecr 1511436730], length 0
[2026-01-24 07:46:06] 07:46:06.188987 eth0  Out IP 172.20.0.10.80 > 172.20.0.1.46034: Flags [F.], seq 1, ack 2, win 510, options [nop,nop,TS val 1511444484 ecr 1744703872], length 0
[2026-01-24 07:46:06] 07:46:06.189156 eth0  In  IP 172.20.0.1.46034 > 172.20.0.10.80: Flags [.], ack 2, win 512, options [nop,nop,TS val 1744703872 ecr 1511444484], length 0
[2026-01-24 07:46:07] 07:46:07.434021 eth0  Out IP 172.20.0.10.80 > 172.20.0.1.46050: Flags [P.], seq 401:406, ack 1016, win 502, options [nop,nop,TS val 1511445729 ecr 1744701115], length 5: HTTP
[2026-01-24 07:46:07] 07:46:07.435916 eth0  In  IP 172.20.0.1.46050 > 172.20.0.10.80: Flags [P.], seq 1016:1025, ack 406, win 512, options [nop,nop,TS val 1744705119 ecr 1511445729], length 9: HTTP
[2026-01-24 07:46:07] 07:46:07.436008 eth0  Out IP 172.20.0.10.80 > 172.20.0.1.46050: Flags [.], ack 1025, win 502, options [nop,nop,TS val 1511445731 ecr 1744705119], length 0
[2026-01-24 07:46:11] 07:46:11.437965 eth0  Out IP 172.20.0.10.80 > 172.20.0.1.46050: Flags [P.], seq 406:411, ack 1025, win 502, options [nop,nop,TS val 1511449733 ecr 1744705119], length 5: HTTP
[2026-01-24 07:46:11] 07:46:11.444311 eth0  In  IP 172.20.0.1.46050 > 172.20.0.10.80: Flags [P.], seq 1025:1034, ack 411, win 512, options [nop,nop,TS val 1744709127 ecr 1511449733], length 9: HTTP
[2026-01-24 07:46:11] 07:46:11.444406 eth0  Out IP 172.20.0.10.80 > 172.20.0.1.46050: Flags [.], ack 1034, win 502, options [nop,nop,TS val 1511449740 ecr 1744709127], length 0
[2026-01-24 07:46:13] 07:46:13.362993 eth0  Out IP 172.20.0.10.80 > 172.20.0.1.46050: Flags [P.], seq 411:415, ack 1034, win 502, options [nop,nop,TS val 1511451658 ecr 1744709127], length 4: HTTP
[2026-01-24 07:46:13] 07:46:13.363237 eth0  Out IP 172.20.0.10.80 > 172.20.0.1.46050: Flags [F.], seq 415, ack 1034, win 502, options [nop,nop,TS val 1511451658 ecr 1744709127], length 0
[2026-01-24 07:46:13] 07:46:13.363744 eth0  In  IP 172.20.0.1.46050 > 172.20.0.10.80: Flags [F.], seq 1034, ack 416, win 512, options [nop,nop,TS val 1744711047 ecr 1511451658], length 0
[2026-01-24 07:46:13] 07:46:13.363886 eth0  Out IP 172.20.0.10.80 > 172.20.0.1.46050: Flags [.], ack 1035, win 502, options [nop,nop,TS val 1511451659 ecr 1744711047], length 0
[2026-01-24 07:46:15] 07:46:15.418161 eth0  In  IP 172.20.0.1.56844 > 172.20.0.10.80: Flags [S], seq 3106490518, win 65495, options [mss 65495,sackOK,TS val 1744713101 ecr 0,nop,wscale 7], length 0
[2026-01-24 07:46:16] 07:46:16.441393 eth0  In  IP 172.20.0.1.56844 > 172.20.0.10.80: Flags [S], seq 3106490518, win 65495, options [mss 65495,sackOK,TS val 1744714125 ecr 0,nop,wscale 7], length 0
[2026-01-24 07:46:17] 07:46:17.470688 eth0  In  IP 172.20.0.1.56844 > 172.20.0.10.80: Flags [S], seq 3106490518, win 65495, options [mss 65495,sackOK,TS val 1744715154 ecr 0,nop,wscale 7], length 0
[2026-01-24 07:46:18] 07:46:18.493446 eth0  In  IP 172.20.0.1.56844 > 172.20.0.10.80: Flags [S], seq 3106490518, win 65495, options [mss 65495,sackOK,TS val 1744716177 ecr 0,nop,wscale 7], length 0
[2026-01-24 07:46:19] 07:46:19.513442 eth0  In  IP 172.20.0.1.56844 > 172.20.0.10.80: Flags [S], seq 3106490518, win 65495, options [mss 65495,sackOK,TS val 1744717197 ecr 0,nop,wscale 7], length 0
[2026-01-24 07:46:20] 07:46:20.545494 eth0  In  IP 172.20.0.1.56844 > 172.20.0.10.80: Flags [S], seq 3106490518, win 65495, options [mss 65495,sackOK,TS val 1744718229 ecr 0,nop,wscale 7], length 0
[2026-01-24 07:46:22] 07:46:22.552182 eth0  In  IP 172.20.0.1.56844 > 172.20.0.10.80: Flags [S], seq 3106490518, win 65495, options [mss 65495,sackOK,TS val 1744720237 ecr 0,nop,wscale 7], length 0
[2026-01-24 07:48:45] 07:48:45.015619 eth0  In  IP 172.20.0.1.48438 > 172.20.0.10.80: Flags [S], seq 778719764, win 65495, options [mss 65495,sackOK,TS val 1744862708 ecr 0,nop,wscale 7], length 0
[2026-01-24 07:48:45] 07:48:45.017034 eth0  Out IP 172.20.0.10.80 > 172.20.0.1.48438: Flags [S.], seq 3460082049, ack 778719765, win 65160, options [mss 1460,sackOK,TS val 1511603322 ecr 1744862708,nop,wscale 7], length 0
[2026-01-24 07:48:45] 07:48:45.017080 eth0  In  IP 172.20.0.1.48438 > 172.20.0.10.80: Flags [.], ack 1, win 512, options [nop,nop,TS val 1744862710 ecr 1511603322], length 0
[2026-01-24 07:48:45] 07:48:45.024395 eth0  In  IP 172.20.0.1.48438 > 172.20.0.10.80: Flags [P.], seq 1:907, ack 1, win 512, options [nop,nop,TS val 1744862718 ecr 1511603322], length 906: HTTP: GET / HTTP/1.1
[2026-01-24 07:48:45] 07:48:45.024459 eth0  Out IP 172.20.0.10.80 > 172.20.0.1.48438: Flags [.], ack 907, win 502, options [nop,nop,TS val 1511603330 ecr 1744862718], length 0
[2026-01-24 07:48:45] 07:48:45.244350 eth0  Out IP 172.20.0.10.80 > 172.20.0.1.48438: Flags [P.], seq 1:403, ack 907, win 502, options [nop,nop,TS val 1511603549 ecr 1744862718], length 402: HTTP: HTTP/1.1 200 OK
[2026-01-24 07:48:45] 07:48:45.244449 eth0  In  IP 172.20.0.1.48438 > 172.20.0.10.80: Flags [.], ack 403, win 509, options [nop,nop,TS val 1744862938 ecr 1511603549], length 0
[2026-01-24 07:48:45] 07:48:45.244988 eth0  Out IP 172.20.0.10.80 > 172.20.0.1.48438: Flags [P.], seq 403:3822, ack 907, win 502, options [nop,nop,TS val 1511603550 ecr 1744862938], length 3419: HTTP
[2026-01-24 07:48:45] 07:48:45.245075 eth0  In  IP 172.20.0.1.48438 > 172.20.0.10.80: Flags [.], ack 3822, win 782, options [nop,nop,TS val 1744862938 ecr 1511603550], length 0
[2026-01-24 07:48:45] 07:48:45.550323 eth0  In  IP 172.20.0.1.48438 > 172.20.0.10.80: Flags [P.], seq 907:1781, ack 3822, win 782, options [nop,nop,TS val 1744863244 ecr 1511603550], length 874: HTTP: GET /_nicegui_ws/socket.io/?client_id=30e82eb7-539d-4e73-b4e8-3c50005439d6&next_message_id=0&EIO=4&transport=polling&t=ld2p6sl3 HTTP/1.1
[2026-01-24 07:48:45] 07:48:45.550639 eth0  Out IP 172.20.0.10.80 > 172.20.0.1.48438: Flags [.], ack 1781, win 501, options [nop,nop,TS val 1511603856 ecr 1744863244], length 0
[2026-01-24 07:48:45] 07:48:45.560050 eth0  Out IP 172.20.0.10.80 > 172.20.0.1.48438: Flags [P.], seq 3822:4174, ack 1781, win 501, options [nop,nop,TS val 1511603865 ecr 1744863244], length 352: HTTP: HTTP/1.1 200 OK
[2026-01-24 07:48:45] 07:48:45.560248 eth0  In  IP 172.20.0.1.48438 > 172.20.0.10.80: Flags [.], ack 4174, win 801, options [nop,nop,TS val 1744863253 ecr 1511603865], length 0
[2026-01-24 07:48:45] 07:48:45.560620 eth0  Out IP 172.20.0.10.80 > 172.20.0.1.48438: Flags [P.], seq 4174:4296, ack 1781, win 501, options [nop,nop,TS val 1511603866 ecr 1744863253], length 122: HTTP
[2026-01-24 07:48:45] 07:48:45.560668 eth0  In  IP 172.20.0.1.48438 > 172.20.0.10.80: Flags [.], ack 4296, win 801, options [nop,nop,TS val 1744863254 ecr 1511603866], length 0
[2026-01-24 07:48:45] 07:48:45.560955 eth0  Out IP 172.20.0.10.80 > 172.20.0.1.48438: Flags [P.], seq 4296:4301, ack 1781, win 501, options [nop,nop,TS val 1511603866 ecr 1744863254], length 5: HTTP
[2026-01-24 07:48:45] 07:48:45.561003 eth0  In  IP 172.20.0.1.48438 > 172.20.0.10.80: Flags [.], ack 4301, win 801, options [nop,nop,TS val 1744863254 ecr 1511603866], length 0
[2026-01-24 07:48:45] 07:48:45.581171 eth0  In  IP 172.20.0.1.48438 > 172.20.0.10.80: Flags [P.], seq 1781:2768, ack 4301, win 801, options [nop,nop,TS val 1744863274 ecr 1511603866], length 987: HTTP: POST /_nicegui_ws/socket.io/?client_id=30e82eb7-539d-4e73-b4e8-3c50005439d6&next_message_id=0&EIO=4&transport=polling&t=ld2q11f4&sid=0vQtfojjQ25vxBdSAAAA HTTP/1.1
[2026-01-24 07:48:45] 07:48:45.590746 eth0  Out IP 172.20.0.10.80 > 172.20.0.1.48438: Flags [P.], seq 4301:4685, ack 2768, win 524, options [nop,nop,TS val 1511603896 ecr 1744863274], length 384: HTTP: HTTP/1.1 200 OK
[2026-01-24 07:48:45] 07:48:45.591113 eth0  Out IP 172.20.0.10.80 > 172.20.0.1.48438: Flags [P.], seq 4685:4692, ack 2768, win 524, options [nop,nop,TS val 1511603896 ecr 1744863274], length 7: HTTP
[2026-01-24 07:48:45] 07:48:45.591292 eth0  In  IP 172.20.0.1.48438 > 172.20.0.10.80: Flags [.], ack 4692, win 801, options [nop,nop,TS val 1744863285 ecr 1511603896], length 0
[2026-01-24 07:48:45] 07:48:45.591481 eth0  Out IP 172.20.0.10.80 > 172.20.0.1.48438: Flags [P.], seq 4692:4697, ack 2768, win 524, options [nop,nop,TS val 1511603897 ecr 1744863285], length 5: HTTP
[2026-01-24 07:48:45] 07:48:45.597576 eth0  In  IP 172.20.0.1.54624 > 172.20.0.10.80: Flags [S], seq 4154661999, win 65495, options [mss 65495,sackOK,TS val 1744863290 ecr 0,nop,wscale 7], length 0
[2026-01-24 07:48:46] 07:48:45.599860 eth0  Out IP 172.20.0.10.80 > 172.20.0.1.54624: Flags [S.], seq 1902705050, ack 4154662000, win 65160, options [mss 1460,sackOK,TS val 1511603905 ecr 1744863290,nop,wscale 7], length 0
[2026-01-24 07:48:46] 07:48:45.599906 eth0  In  IP 172.20.0.1.54624 > 172.20.0.10.80: Flags [.], ack 1, win 512, options [nop,nop,TS val 1744863293 ecr 1511603905], length 0
[2026-01-24 07:48:46] 07:48:45.600954 eth0  In  IP 172.20.0.1.54624 > 172.20.0.10.80: Flags [P.], seq 1:900, ack 1, win 512, options [nop,nop,TS val 1744863294 ecr 1511603905], length 899: HTTP: GET /_nicegui_ws/socket.io/?client_id=30e82eb7-539d-4e73-b4e8-3c50005439d6&next_message_id=0&EIO=4&transport=polling&t=ld2q9kaz&sid=0vQtfojjQ25vxBdSAAAA HTTP/1.1
[2026-01-24 07:48:46] 07:48:45.601151 eth0  Out IP 172.20.0.10.80 > 172.20.0.1.54624: Flags [.], ack 900, win 503, options [nop,nop,TS val 1511603906 ecr 1744863294], length 0
[2026-01-24 07:48:46] 07:48:45.603714 eth0  Out IP 172.20.0.10.80 > 172.20.0.1.54624: Flags [P.], seq 1:353, ack 900, win 503, options [nop,nop,TS val 1511603909 ecr 1744863294], length 352: HTTP: HTTP/1.1 200 OK
[2026-01-24 07:48:46] 07:48:45.603780 eth0  In  IP 172.20.0.1.54624 > 172.20.0.10.80: Flags [.], ack 353, win 510, options [nop,nop,TS val 1744863297 ecr 1511603909], length 0
[2026-01-24 07:48:46] 07:48:45.604018 eth0  Out IP 172.20.0.10.80 > 172.20.0.1.54624: Flags [P.], seq 353:391, ack 900, win 503, options [nop,nop,TS val 1511603909 ecr 1744863297], length 38: HTTP
[2026-01-24 07:48:46] 07:48:45.604060 eth0  In  IP 172.20.0.1.54624 > 172.20.0.10.80: Flags [.], ack 391, win 510, options [nop,nop,TS val 1744863297 ecr 1511603909], length 0
[2026-01-24 07:48:46] 07:48:45.604290 eth0  Out IP 172.20.0.10.80 > 172.20.0.1.54624: Flags [P.], seq 391:396, ack 900, win 503, options [nop,nop,TS val 1511603910 ecr 1744863297], length 5: HTTP
[2026-01-24 07:48:46] 07:48:45.604334 eth0  In  IP 172.20.0.1.54624 > 172.20.0.10.80: Flags [.], ack 396, win 510, options [nop,nop,TS val 1744863298 ecr 1511603910], length 0
[2026-01-24 07:48:46] 07:48:45.609564 eth0  In  IP 172.20.0.1.54624 > 172.20.0.10.80: Flags [P.], seq 900:1799, ack 396, win 512, options [nop,nop,TS val 1744863303 ecr 1511603910], length 899: HTTP: GET /_nicegui_ws/socket.io/?client_id=30e82eb7-539d-4e73-b4e8-3c50005439d6&next_message_id=0&EIO=4&transport=polling&t=ld2quctr&sid=0vQtfojjQ25vxBdSAAAA HTTP/1.1
[2026-01-24 07:48:46] 07:48:45.610259 eth0  In  IP 172.20.0.1.48438 > 172.20.0.10.80: Flags [P.], seq 2768:3963, ack 4697, win 801, options [nop,nop,TS val 1744863304 ecr 1511603897], length 1195: HTTP: POST /_nicegui_ws/socket.io/?client_id=30e82eb7-539d-4e73-b4e8-3c50005439d6&next_message_id=0&EIO=4&transport=polling&t=ld2qvysd&sid=0vQtfojjQ25vxBdSAAAA HTTP/1.1
[2026-01-24 07:48:46] 07:48:45.615659 eth0  Out IP 172.20.0.10.80 > 172.20.0.1.48438: Flags [P.], seq 4697:5081, ack 3963, win 547, options [nop,nop,TS val 1511603921 ecr 1744863304], length 384: HTTP: HTTP/1.1 200 OK
[2026-01-24 07:48:46] 07:48:45.616059 eth0  Out IP 172.20.0.10.80 > 172.20.0.1.48438: Flags [P.], seq 5081:5088, ack 3963, win 547, options [nop,nop,TS val 1511603921 ecr 1744863304], length 7: HTTP
[2026-01-24 07:48:46] 07:48:45.616162 eth0  In  IP 172.20.0.1.48438 > 172.20.0.10.80: Flags [.], ack 5088, win 801, options [nop,nop,TS val 1744863309 ecr 1511603921], length 0
[2026-01-24 07:48:46] 07:48:45.616674 eth0  Out IP 172.20.0.10.80 > 172.20.0.1.54624: Flags [P.], seq 396:748, ack 1799, win 501, options [nop,nop,TS val 1511603922 ecr 1744863303], length 352: HTTP: HTTP/1.1 200 OK
[2026-01-24 07:48:46] 07:48:45.616755 eth0  Out IP 172.20.0.10.80 > 172.20.0.1.48438: Flags [P.], seq 5088:5093, ack 3963, win 547, options [nop,nop,TS val 1511603922 ecr 1744863309], length 5: HTTP
[2026-01-24 07:48:46] 07:48:45.617026 eth0  Out IP 172.20.0.10.80 > 172.20.0.1.54624: Flags [P.], seq 748:762, ack 1799, win 501, options [nop,nop,TS val 1511603922 ecr 1744863303], length 14: HTTP
[2026-01-24 07:48:46] 07:48:45.617133 eth0  In  IP 172.20.0.1.54624 > 172.20.0.10.80: Flags [.], ack 762, win 512, options [nop,nop,TS val 1744863310 ecr 1511603922], length 0
[2026-01-24 07:48:46] 07:48:45.617332 eth0  Out IP 172.20.0.10.80 > 172.20.0.1.54624: Flags [P.], seq 762:767, ack 1799, win 501, options [nop,nop,TS val 1511603923 ecr 1744863310], length 5: HTTP
[2026-01-24 07:48:46] 07:48:45.659355 eth0  In  IP 172.20.0.1.54624 > 172.20.0.10.80: Flags [.], ack 767, win 512, options [nop,nop,TS val 1744863353 ecr 1511603923], length 0
[2026-01-24 07:48:46] 07:48:45.659381 eth0  In  IP 172.20.0.1.48438 > 172.20.0.10.80: Flags [.], ack 5093, win 801, options [nop,nop,TS val 1744863353 ecr 1511603922], length 0
[2026-01-24 07:48:46] 07:48:45.684135 eth0  In  IP 172.20.0.1.54624 > 172.20.0.10.80: Flags [P.], seq 1799:2698, ack 767, win 512, options [nop,nop,TS val 1744863377 ecr 1511603923], length 899: HTTP: GET /_nicegui_ws/socket.io/?client_id=30e82eb7-539d-4e73-b4e8-3c50005439d6&next_message_id=0&EIO=4&transport=polling&t=ld2sxjqd&sid=0vQtfojjQ25vxBdSAAAA HTTP/1.1
[2026-01-24 07:48:46] 07:48:45.731440 eth0  Out IP 172.20.0.10.80 > 172.20.0.1.54624: Flags [.], ack 2698, win 501, options [nop,nop,TS val 1511604037 ecr 1744863377], length 0
[2026-01-24 07:48:46] 07:48:46.086328 eth0  In  IP 172.20.0.1.54634 > 172.20.0.10.80: Flags [S], seq 1489261549, win 65495, options [mss 65495,sackOK,TS val 1744863777 ecr 0,nop,wscale 7], length 0
[2026-01-24 07:48:46] 07:48:46.086880 eth0  Out IP 172.20.0.10.80 > 172.20.0.1.54634: Flags [S.], seq 1344301665, ack 1489261550, win 65160, options [mss 1460,sackOK,TS val 1511604392 ecr 1744863777,nop,wscale 7], length 0
[2026-01-24 07:48:46] 07:48:46.086916 eth0  In  IP 172.20.0.1.54634 > 172.20.0.10.80: Flags [.], ack 1, win 512, options [nop,nop,TS val 1744863780 ecr 1511604392], length 0
[2026-01-24 07:48:46] 07:48:46.089427 eth0  In  IP 172.20.0.1.54634 > 172.20.0.10.80: Flags [P.], seq 1:841, ack 1, win 512, options [nop,nop,TS val 1744863783 ecr 1511604392], length 840: HTTP: GET /_nicegui_ws/socket.io/?client_id=30e82eb7-539d-4e73-b4e8-3c50005439d6&next_message_id=0&EIO=4&transport=websocket&sid=0vQtfojjQ25vxBdSAAAA HTTP/1.1
[2026-01-24 07:48:46] 07:48:46.089522 eth0  Out IP 172.20.0.10.80 > 172.20.0.1.54634: Flags [.], ack 841, win 503, options [nop,nop,TS val 1511604395 ecr 1744863783], length 0
[2026-01-24 07:48:46] 07:48:46.112065 eth0  Out IP 172.20.0.10.80 > 172.20.0.1.54634: Flags [P.], seq 1:257, ack 841, win 503, options [nop,nop,TS val 1511604417 ecr 1744863783], length 256: HTTP: HTTP/1.1 101 Switching Protocols
[2026-01-24 07:48:46] 07:48:46.112198 eth0  In  IP 172.20.0.1.54634 > 172.20.0.10.80: Flags [.], ack 257, win 510, options [nop,nop,TS val 1744863805 ecr 1511604417], length 0
[2026-01-24 07:48:46] 07:48:46.147242 eth0  In  IP 172.20.0.1.54634 > 172.20.0.10.80: Flags [P.], seq 841:855, ack 257, win 512, options [nop,nop,TS val 1744863840 ecr 1511604417], length 14: HTTP
[2026-01-24 07:48:46] 07:48:46.148473 eth0  Out IP 172.20.0.10.80 > 172.20.0.1.54634: Flags [P.], seq 257:267, ack 855, win 503, options [nop,nop,TS val 1511604454 ecr 1744863840], length 10: HTTP
[2026-01-24 07:48:46] 07:48:46.149651 eth0  Out IP 172.20.0.10.80 > 172.20.0.1.54624: Flags [P.], seq 767:1119, ack 2698, win 501, options [nop,nop,TS val 1511604455 ecr 1744863377], length 352: HTTP: HTTP/1.1 200 OK
[2026-01-24 07:48:46] 07:48:46.149732 eth0  In  IP 172.20.0.1.54624 > 172.20.0.10.80: Flags [.], ack 1119, win 510, options [nop,nop,TS val 1744863843 ecr 1511604455], length 0
[2026-01-24 07:48:47] 07:48:46.150073 eth0  Out IP 172.20.0.10.80 > 172.20.0.1.54624: Flags [P.], seq 1119:1125, ack 2698, win 501, options [nop,nop,TS val 1511604455 ecr 1744863843], length 6: HTTP
[2026-01-24 07:48:47] 07:48:46.150123 eth0  In  IP 172.20.0.1.54624 > 172.20.0.10.80: Flags [.], ack 1125, win 510, options [nop,nop,TS val 1744863843 ecr 1511604455], length 0
[2026-01-24 07:48:47] 07:48:46.150414 eth0  Out IP 172.20.0.10.80 > 172.20.0.1.54624: Flags [P.], seq 1125:1130, ack 2698, win 501, options [nop,nop,TS val 1511604456 ecr 1744863843], length 5: HTTP
[2026-01-24 07:48:47] 07:48:46.150465 eth0  In  IP 172.20.0.1.54624 > 172.20.0.10.80: Flags [.], ack 1130, win 510, options [nop,nop,TS val 1744863844 ecr 1511604456], length 0
[2026-01-24 07:48:47] 07:48:46.158902 eth0  In  IP 172.20.0.1.54634 > 172.20.0.10.80: Flags [P.], seq 855:864, ack 267, win 512, options [nop,nop,TS val 1744863852 ecr 1511604454], length 9: HTTP
[2026-01-24 07:48:47] 07:48:46.199289 eth0  Out IP 172.20.0.10.80 > 172.20.0.1.54634: Flags [.], ack 864, win 503, options [nop,nop,TS val 1511604505 ecr 1744863852], length 0
[2026-01-24 07:48:49] 07:48:49.291536 eth0  In  IP 172.20.0.1.54634 > 172.20.0.10.80: Flags [P.], seq 864:950, ack 267, win 512, options [nop,nop,TS val 1744866985 ecr 1511604505], length 86: HTTP
[2026-01-24 07:48:49] 07:48:49.291905 eth0  Out IP 172.20.0.10.80 > 172.20.0.1.54634: Flags [.], ack 950, win 503, options [nop,nop,TS val 1511607597 ecr 1744866985], length 0
[2026-01-24 07:48:49] 07:48:49.559406 eth0  Out IP 172.20.0.10.80 > 172.20.0.1.54634: Flags [P.], seq 267:272, ack 950, win 503, options [nop,nop,TS val 1511607865 ecr 1744866985], length 5: HTTP
[2026-01-24 07:48:49] 07:48:49.560971 eth0  In  IP 172.20.0.1.54634 > 172.20.0.10.80: Flags [P.], seq 950:959, ack 272, win 512, options [nop,nop,TS val 1744867254 ecr 1511607865], length 9: HTTP
[2026-01-24 07:48:49] 07:48:49.561029 eth0  Out IP 172.20.0.10.80 > 172.20.0.1.54634: Flags [.], ack 959, win 503, options [nop,nop,TS val 1511607866 ecr 1744867254], length 0
[2026-01-24 07:48:50] 07:48:50.617539 eth0  Out IP 172.20.0.10.80 > 172.20.0.1.48438: Flags [F.], seq 5093, ack 3963, win 547, options [nop,nop,TS val 1511608923 ecr 1744863353], length 0
[2026-01-24 07:48:50] 07:48:50.621670 eth0  In  IP 172.20.0.1.48438 > 172.20.0.10.80: Flags [F.], seq 3963, ack 5094, win 801, options [nop,nop,TS val 1744868315 ecr 1511608923], length 0
[2026-01-24 07:48:50] 07:48:50.621842 eth0  Out IP 172.20.0.10.80 > 172.20.0.1.48438: Flags [.], ack 3964, win 547, options [nop,nop,TS val 1511608927 ecr 1744868315], length 0
[2026-01-24 07:48:51] 07:48:51.153051 eth0  Out IP 172.20.0.10.80 > 172.20.0.1.54624: Flags [F.], seq 1130, ack 2698, win 501, options [nop,nop,TS val 1511609458 ecr 1744863844], length 0
[2026-01-24 07:48:51] 07:48:51.155379 eth0  In  IP 172.20.0.1.54624 > 172.20.0.10.80: Flags [F.], seq 2698, ack 1131, win 512, options [nop,nop,TS val 1744868849 ecr 1511609458], length 0
[2026-01-24 07:48:51] 07:48:51.155455 eth0  Out IP 172.20.0.10.80 > 172.20.0.1.54624: Flags [.], ack 2699, win 501, options [nop,nop,TS val 1511609461 ecr 1744868849], length 0
[2026-01-24 07:48:51] 07:48:51.146613 eth0  In  IP 172.20.0.1.54638 > 172.20.0.10.80: Flags [S], seq 30720248, win 65495, options [mss 65495,sackOK,TS val 1744868864 ecr 0,nop,wscale 7], length 0
[2026-01-24 07:48:51] 07:48:51.146694 eth0  Out IP 172.20.0.10.80 > 172.20.0.1.54638: Flags [S.], seq 1264292593, ack 30720249, win 65160, options [mss 1460,sackOK,TS val 1511609476 ecr 1744868864,nop,wscale 7], length 0
[2026-01-24 07:48:51] 07:48:51.146712 eth0  In  IP 172.20.0.1.54638 > 172.20.0.10.80: Flags [.], ack 1, win 512, options [nop,nop,TS val 1744868864 ecr 1511609476], length 0
[2026-01-24 07:48:51] 07:48:51.147758 eth0  In  IP 172.20.0.1.54638 > 172.20.0.10.80: Flags [P.], seq 1:914, ack 1, win 512, options [nop,nop,TS val 1744868865 ecr 1511609476], length 913: HTTP: GET /login HTTP/1.1
[2026-01-24 07:48:51] 07:48:51.147817 eth0  Out IP 172.20.0.10.80 > 172.20.0.1.54638: Flags [.], ack 914, win 509, options [nop,nop,TS val 1511609477 ecr 1744868865], length 0
[2026-01-24 07:48:51] 07:48:51.160624 eth0  In  IP 172.20.0.1.54654 > 172.20.0.10.80: Flags [S], seq 1282638042, win 65495, options [mss 65495,sackOK,TS val 1744868878 ecr 0,nop,wscale 7], length 0
[2026-01-24 07:48:51] 07:48:51.160773 eth0  Out IP 172.20.0.10.80 > 172.20.0.1.54654: Flags [S.], seq 3530068450, ack 1282638043, win 65160, options [mss 1460,sackOK,TS val 1511609490 ecr 1744868878,nop,wscale 7], length 0
[2026-01-24 07:48:51] 07:48:51.160842 eth0  In  IP 172.20.0.1.54654 > 172.20.0.10.80: Flags [.], ack 1, win 512, options [nop,nop,TS val 1744868878 ecr 1511609490], length 0
[2026-01-24 07:48:51] 07:48:51.172490 eth0  Out IP 172.20.0.10.80 > 172.20.0.1.54638: Flags [P.], seq 1:403, ack 914, win 510, options [nop,nop,TS val 1511609502 ecr 1744868865], length 402: HTTP: HTTP/1.1 200 OK
[2026-01-24 07:48:51] 07:48:51.172597 eth0  In  IP 172.20.0.1.54638 > 172.20.0.10.80: Flags [.], ack 403, win 509, options [nop,nop,TS val 1744868890 ecr 1511609502], length 0
[2026-01-24 07:48:51] 07:48:51.172819 eth0  Out IP 172.20.0.10.80 > 172.20.0.1.54638: Flags [P.], seq 403:3550, ack 914, win 510, options [nop,nop,TS val 1511609502 ecr 1744868890], length 3147: HTTP
[2026-01-24 07:48:51] 07:48:51.172857 eth0  In  IP 172.20.0.1.54638 > 172.20.0.10.80: Flags [.], ack 3550, win 772, options [nop,nop,TS val 1744868890 ecr 1511609502], length 0
[2026-01-24 07:48:51] 07:48:51.180565 eth0  In  IP 172.20.0.1.54634 > 172.20.0.10.80: Flags [P.], seq 959:967, ack 272, win 512, options [nop,nop,TS val 1744868898 ecr 1511607866], length 8: HTTP
[2026-01-24 07:48:51] 07:48:51.180636 eth0  Out IP 172.20.0.10.80 > 172.20.0.1.54634: Flags [.], ack 967, win 503, options [nop,nop,TS val 1511609510 ecr 1744868898], length 0
[2026-01-24 07:48:51] 07:48:51.182182 eth0  Out IP 172.20.0.10.80 > 172.20.0.1.54634: Flags [P.], seq 272:276, ack 967, win 503, options [nop,nop,TS val 1511609512 ecr 1744868898], length 4: HTTP
[2026-01-24 07:48:51] 07:48:51.182740 eth0  In  IP 172.20.0.1.54634 > 172.20.0.10.80: Flags [F.], seq 967, ack 276, win 512, options [nop,nop,TS val 1744868900 ecr 1511609512], length 0
[2026-01-24 07:48:51] 07:48:51.182792 eth0  Out IP 172.20.0.10.80 > 172.20.0.1.54634: Flags [.], ack 968, win 503, options [nop,nop,TS val 1511609512 ecr 1744868900], length 0
[2026-01-24 07:48:52] 07:48:51.330837 eth0  In  IP 172.20.0.1.54662 > 172.20.0.10.80: Flags [S], seq 2628091042, win 65495, options [mss 65495,sackOK,TS val 1744869048 ecr 0,nop,wscale 7], length 0
[2026-01-24 07:48:52] 07:48:51.330970 eth0  Out IP 172.20.0.10.80 > 172.20.0.1.54662: Flags [S.], seq 1008812334, ack 2628091043, win 65160, options [mss 1460,sackOK,TS val 1511609661 ecr 1744869048,nop,wscale 7], length 0
[2026-01-24 07:48:52] 07:48:51.331004 eth0  In  IP 172.20.0.1.54662 > 172.20.0.10.80: Flags [.], ack 1, win 512, options [nop,nop,TS val 1744869049 ecr 1511609661], length 0
[2026-01-24 07:48:52] 07:48:51.331623 eth0  In  IP 172.20.0.1.54662 > 172.20.0.10.80: Flags [P.], seq 1:816, ack 1, win 512, options [nop,nop,TS val 1744869049 ecr 1511609661], length 815: HTTP: GET /_nicegui_ws/socket.io/?client_id=f0b63f3a-6870-4b63-8550-7ffbef7186af&next_message_id=0&EIO=4&transport=websocket HTTP/1.1
[2026-01-24 07:48:52] 07:48:51.331675 eth0  Out IP 172.20.0.10.80 > 172.20.0.1.54662: Flags [.], ack 816, win 503, options [nop,nop,TS val 1511609661 ecr 1744869049], length 0
[2026-01-24 07:48:52] 07:48:51.333103 eth0  Out IP 172.20.0.10.80 > 172.20.0.1.54662: Flags [P.], seq 1:257, ack 816, win 503, options [nop,nop,TS val 1511609663 ecr 1744869049], length 256: HTTP: HTTP/1.1 101 Switching Protocols
[2026-01-24 07:48:52] 07:48:51.333175 eth0  In  IP 172.20.0.1.54662 > 172.20.0.10.80: Flags [.], ack 257, win 510, options [nop,nop,TS val 1744869051 ecr 1511609663], length 0
[2026-01-24 07:48:52] 07:48:51.334058 eth0  Out IP 172.20.0.10.80 > 172.20.0.1.54662: Flags [P.], seq 257:354, ack 816, win 503, options [nop,nop,TS val 1511609664 ecr 1744869051], length 97: HTTP
[2026-01-24 07:48:52] 07:48:51.334127 eth0  In  IP 172.20.0.1.54662 > 172.20.0.10.80: Flags [.], ack 354, win 510, options [nop,nop,TS val 1744869052 ecr 1511609664], length 0
