[2026-03-06 08:55:51] 1772762151.197908 IP 172.20.0.1.50122 > 172.20.0.10.80: Flags [S], seq 1394687773, win 65495, options [mss 65495,sackOK,TS val 3671635963 ecr 0,nop,wscale 7], length 0
[2026-03-06 08:55:51] 1772762151.199297 IP 172.20.0.10.50122 > 172.20.0.30.8080: Flags [S], seq 1394687773, win 65495, options [mss 65495,sackOK,TS val 3671635963 ecr 0,nop,wscale 7], length 0
[2026-03-06 08:55:51] 1772762151.199541 IP 172.20.0.30.8080 > 172.20.0.10.50122: Flags [S.], seq 277160194, ack 1394687774, win 65160, options [mss 1460,sackOK,TS val 280998521 ecr 3671635963,nop,wscale 7], length 0
[2026-03-06 08:55:51] 1772762151.199954 IP 172.20.0.10.80 > 172.20.0.1.50122: Flags [S.], seq 277160194, ack 1394687774, win 65160, options [mss 1460,sackOK,TS val 280998521 ecr 3671635963,nop,wscale 7], length 0
[2026-03-06 08:55:51] 1772762151.200090 IP 172.20.0.1.50122 > 172.20.0.10.80: Flags [.], ack 1, win 512, options [nop,nop,TS val 3671635970 ecr 280998521], length 0
[2026-03-06 08:55:51] 1772762151.200201 IP 172.20.0.10.50122 > 172.20.0.30.8080: Flags [.], ack 1, win 512, options [nop,nop,TS val 3671635970 ecr 280998521], length 0
[2026-03-06 08:55:52] 1772762151.221525 IP 172.20.0.1.50130 > 172.20.0.10.80: Flags [S], seq 4126379481, win 65495, options [mss 65495,sackOK,TS val 3671635991 ecr 0,nop,wscale 7], length 0
[2026-03-06 08:55:52] 1772762151.221601 IP 172.20.0.10.50130 > 172.20.0.30.8080: Flags [S], seq 4126379481, win 65495, options [mss 65495,sackOK,TS val 3671635991 ecr 0,nop,wscale 7], length 0
[2026-03-06 08:55:52] 1772762151.221689 IP 172.20.0.30.8080 > 172.20.0.10.50130: Flags [S.], seq 3393515889, ack 4126379482, win 65160, options [mss 1460,sackOK,TS val 280998544 ecr 3671635991,nop,wscale 7], length 0
[2026-03-06 08:55:52] 1772762151.221720 IP 172.20.0.10.80 > 172.20.0.1.50130: Flags [S.], seq 3393515889, ack 4126379482, win 65160, options [mss 1460,sackOK,TS val 280998544 ecr 3671635991,nop,wscale 7], length 0
[2026-03-06 08:55:52] 1772762151.221788 IP 172.20.0.1.50130 > 172.20.0.10.80: Flags [.], ack 1, win 512, options [nop,nop,TS val 3671635992 ecr 280998544], length 0
[2026-03-06 08:55:52] 1772762151.221814 IP 172.20.0.10.50130 > 172.20.0.30.8080: Flags [.], ack 1, win 512, options [nop,nop,TS val 3671635992 ecr 280998544], length 0
[2026-03-06 08:55:52] 1772762151.318073 IP 172.20.0.1.50122 > 172.20.0.10.80: Flags [P.], seq 1:973, ack 1, win 512, options [nop,nop,TS val 3671636088 ecr 280998521], length 972: HTTP: GET / HTTP/1.1
[2026-03-06 08:55:52] 1772762151.319208 IP 172.20.0.10.50122 > 172.20.0.30.8080: Flags [P.], seq 1:973, ack 1, win 512, options [nop,nop,TS val 3671636088 ecr 280998521], length 972: HTTP: GET / HTTP/1.1
[2026-03-06 08:55:52] 1772762151.319347 IP 172.20.0.30.8080 > 172.20.0.10.50122: Flags [.], ack 973, win 525, options [nop,nop,TS val 280998641 ecr 3671636088], length 0
[2026-03-06 08:55:52] 1772762151.319385 IP 172.20.0.10.80 > 172.20.0.1.50122: Flags [.], ack 973, win 525, options [nop,nop,TS val 280998641 ecr 3671636088], length 0
[2026-03-06 08:55:52] 1772762152.279982 IP 172.20.0.30.8080 > 172.20.0.10.50122: Flags [P.], seq 1:403, ack 973, win 525, options [nop,nop,TS val 280999602 ecr 3671636088], length 402: HTTP: HTTP/1.1 200 OK
[2026-03-06 08:55:52] 1772762152.284661 IP 172.20.0.10.80 > 172.20.0.1.50122: Flags [P.], seq 1:403, ack 973, win 525, options [nop,nop,TS val 280999602 ecr 3671636088], length 402: HTTP: HTTP/1.1 200 OK
[2026-03-06 08:55:52] 1772762152.284761 IP 172.20.0.1.50122 > 172.20.0.10.80: Flags [.], ack 403, win 509, options [nop,nop,TS val 3671637055 ecr 280999602], length 0
[2026-03-06 08:55:52] 1772762152.284799 IP 172.20.0.10.50122 > 172.20.0.30.8080: Flags [.], ack 403, win 509, options [nop,nop,TS val 3671637055 ecr 280999602], length 0
[2026-03-06 08:55:52] 1772762152.292122 IP 172.20.0.30.8080 > 172.20.0.10.50122: Flags [P.], seq 403:4338, ack 973, win 525, options [nop,nop,TS val 280999609 ecr 3671637055], length 3935: HTTP
[2026-03-06 08:55:52] 1772762152.292193 IP 172.20.0.10.80 > 172.20.0.1.50122: Flags [P.], seq 403:4338, ack 973, win 525, options [nop,nop,TS val 280999609 ecr 3671637055], length 3935: HTTP
[2026-03-06 08:55:52] 1772762152.292887 IP 172.20.0.1.50122 > 172.20.0.10.80: Flags [.], ack 4338, win 802, options [nop,nop,TS val 3671637062 ecr 280999609], length 0
[2026-03-06 08:55:52] 1772762152.292914 IP 172.20.0.10.50122 > 172.20.0.30.8080: Flags [.], ack 4338, win 802, options [nop,nop,TS val 3671637062 ecr 280999609], length 0
[2026-03-06 08:55:52] 1772762152.374309 IP 172.20.0.1.50122 > 172.20.0.10.80: Flags [P.], seq 973:1840, ack 4338, win 802, options [nop,nop,TS val 3671637144 ecr 280999609], length 867: HTTP: GET /_nicegui/3.8.0/static/fonts.css HTTP/1.1
[2026-03-06 08:55:52] 1772762152.374362 IP 172.20.0.10.50122 > 172.20.0.30.8080: Flags [P.], seq 973:1840, ack 4338, win 802, options [nop,nop,TS val 3671637144 ecr 280999609], length 867: HTTP: GET /_nicegui/3.8.0/static/fonts.css HTTP/1.1
[2026-03-06 08:55:52] 1772762152.374410 IP 172.20.0.30.8080 > 172.20.0.10.50122: Flags [.], ack 1840, win 519, options [nop,nop,TS val 280999696 ecr 3671637144], length 0
[2026-03-06 08:55:52] 1772762152.374415 IP 172.20.0.10.80 > 172.20.0.1.50122: Flags [.], ack 1840, win 519, options [nop,nop,TS val 280999696 ecr 3671637144], length 0
[2026-03-06 08:55:53] 1772762152.378026 IP 172.20.0.1.50130 > 172.20.0.10.80: Flags [P.], seq 1:886, ack 1, win 512, options [nop,nop,TS val 3671637148 ecr 280998544], length 885: HTTP: GET /_nicegui/3.8.0/static/quasar.unimportant.prod.css HTTP/1.1
[2026-03-06 08:55:53] 1772762152.378054 IP 172.20.0.10.50130 > 172.20.0.30.8080: Flags [P.], seq 1:886, ack 1, win 512, options [nop,nop,TS val 3671637148 ecr 280998544], length 885: HTTP: GET /_nicegui/3.8.0/static/quasar.unimportant.prod.css HTTP/1.1
[2026-03-06 08:55:53] 1772762152.378095 IP 172.20.0.30.8080 > 172.20.0.10.50130: Flags [.], ack 886, win 503, options [nop,nop,TS val 280999700 ecr 3671637148], length 0
[2026-03-06 08:55:53] 1772762152.378100 IP 172.20.0.10.80 > 172.20.0.1.50130: Flags [.], ack 886, win 503, options [nop,nop,TS val 280999700 ecr 3671637148], length 0
[2026-03-06 08:55:53] 1772762152.384743 IP 172.20.0.1.50138 > 172.20.0.10.80: Flags [S], seq 1320376202, win 65495, options [mss 65495,sackOK,TS val 3671637155 ecr 0,nop,wscale 7], length 0
[2026-03-06 08:55:53] 1772762152.384778 IP 172.20.0.10.50138 > 172.20.0.30.8080: Flags [S], seq 1320376202, win 65495, options [mss 65495,sackOK,TS val 3671637155 ecr 0,nop,wscale 7], length 0
[2026-03-06 08:55:53] 1772762152.384858 IP 172.20.0.30.8080 > 172.20.0.10.50138: Flags [S.], seq 2957261834, ack 1320376203, win 65160, options [mss 1460,sackOK,TS val 280999707 ecr 3671637155,nop,wscale 7], length 0
[2026-03-06 08:55:53] 1772762152.384864 IP 172.20.0.10.80 > 172.20.0.1.50138: Flags [S.], seq 2957261834, ack 1320376203, win 65160, options [mss 1460,sackOK,TS val 280999707 ecr 3671637155,nop,wscale 7], length 0
[2026-03-06 08:55:53] 1772762152.384887 IP 172.20.0.1.50138 > 172.20.0.10.80: Flags [.], ack 1, win 512, options [nop,nop,TS val 3671637155 ecr 280999707], length 0
[2026-03-06 08:55:53] 1772762152.384891 IP 172.20.0.10.50138 > 172.20.0.30.8080: Flags [.], ack 1, win 512, options [nop,nop,TS val 3671637155 ecr 280999707], length 0
[2026-03-06 08:55:53] 1772762152.386205 IP 172.20.0.1.50138 > 172.20.0.10.80: Flags [P.], seq 1:884, ack 1, win 512, options [nop,nop,TS val 3671637156 ecr 280999707], length 883: HTTP: GET /_nicegui/3.8.0/static/quasar.important.prod.css HTTP/1.1
[2026-03-06 08:55:53] 1772762152.386229 IP 172.20.0.10.50138 > 172.20.0.30.8080: Flags [P.], seq 1:884, ack 1, win 512, options [nop,nop,TS val 3671637156 ecr 280999707], length 883: HTTP: GET /_nicegui/3.8.0/static/quasar.important.prod.css HTTP/1.1
[2026-03-06 08:55:53] 1772762152.386263 IP 172.20.0.30.8080 > 172.20.0.10.50138: Flags [.], ack 884, win 503, options [nop,nop,TS val 280999708 ecr 3671637156], length 0
[2026-03-06 08:55:53] 1772762152.386268 IP 172.20.0.10.80 > 172.20.0.1.50138: Flags [.], ack 884, win 503, options [nop,nop,TS val 280999708 ecr 3671637156], length 0
[2026-03-06 08:55:53] 1772762152.389757 IP 172.20.0.1.50142 > 172.20.0.10.80: Flags [S], seq 2355328656, win 65495, options [mss 65495,sackOK,TS val 3671637160 ecr 0,nop,wscale 7], length 0
[2026-03-06 08:55:53] 1772762152.389793 IP 172.20.0.10.50142 > 172.20.0.30.8080: Flags [S], seq 2355328656, win 65495, options [mss 65495,sackOK,TS val 3671637160 ecr 0,nop,wscale 7], length 0
[2026-03-06 08:55:53] 1772762152.389853 IP 172.20.0.30.8080 > 172.20.0.10.50142: Flags [S.], seq 3175266147, ack 2355328657, win 65160, options [mss 1460,sackOK,TS val 280999712 ecr 3671637160,nop,wscale 7], length 0
[2026-03-06 08:55:53] 1772762152.389859 IP 172.20.0.10.80 > 172.20.0.1.50142: Flags [S.], seq 3175266147, ack 2355328657, win 65160, options [mss 1460,sackOK,TS val 280999712 ecr 3671637160,nop,wscale 7], length 0
[2026-03-06 08:55:53] 1772762152.389877 IP 172.20.0.1.50142 > 172.20.0.10.80: Flags [.], ack 1, win 512, options [nop,nop,TS val 3671637160 ecr 280999712], length 0
[2026-03-06 08:55:53] 1772762152.389880 IP 172.20.0.10.50142 > 172.20.0.30.8080: Flags [.], ack 1, win 512, options [nop,nop,TS val 3671637160 ecr 280999712], length 0
[2026-03-06 08:55:54] 1772762152.390191 IP 172.20.0.1.50142 > 172.20.0.10.80: Flags [P.], seq 1:870, ack 1, win 512, options [nop,nop,TS val 3671637160 ecr 280999712], length 869: HTTP: GET /_nicegui/3.8.0/static/nicegui.css HTTP/1.1
[2026-03-06 08:55:54] 1772762152.390203 IP 172.20.0.10.50142 > 172.20.0.30.8080: Flags [P.], seq 1:870, ack 1, win 512, options [nop,nop,TS val 3671637160 ecr 280999712], length 869: HTTP: GET /_nicegui/3.8.0/static/nicegui.css HTTP/1.1
[2026-03-06 08:55:54] 1772762152.390231 IP 172.20.0.30.8080 > 172.20.0.10.50142: Flags [.], ack 870, win 503, options [nop,nop,TS val 280999712 ecr 3671637160], length 0
[2026-03-06 08:55:54] 1772762152.390235 IP 172.20.0.10.80 > 172.20.0.1.50142: Flags [.], ack 870, win 503, options [nop,nop,TS val 280999712 ecr 3671637160], length 0
[2026-03-06 08:55:54] 1772762152.392997 IP 172.20.0.1.50154 > 172.20.0.10.80: Flags [S], seq 115396807, win 65495, options [mss 65495,sackOK,TS val 3671637163 ecr 0,nop,wscale 7], length 0
[2026-03-06 08:55:54] 1772762152.393034 IP 172.20.0.10.50154 > 172.20.0.30.8080: Flags [S], seq 115396807, win 65495, options [mss 65495,sackOK,TS val 3671637163 ecr 0,nop,wscale 7], length 0
[2026-03-06 08:55:54] 1772762152.393085 IP 172.20.0.30.8080 > 172.20.0.10.50154: Flags [S.], seq 3572620798, ack 115396808, win 65160, options [mss 1460,sackOK,TS val 280999715 ecr 3671637163,nop,wscale 7], length 0
[2026-03-06 08:55:54] 1772762152.393091 IP 172.20.0.10.80 > 172.20.0.1.50154: Flags [S.], seq 3572620798, ack 115396808, win 65160, options [mss 1460,sackOK,TS val 280999715 ecr 3671637163,nop,wscale 7], length 0
[2026-03-06 08:55:54] 1772762152.393112 IP 172.20.0.1.50154 > 172.20.0.10.80: Flags [.], ack 1, win 512, options [nop,nop,TS val 3671637163 ecr 280999715], length 0
[2026-03-06 08:55:54] 1772762152.393116 IP 172.20.0.10.50154 > 172.20.0.30.8080: Flags [.], ack 1, win 512, options [nop,nop,TS val 3671637163 ecr 280999715], length 0
[2026-03-06 08:55:54] 1772762152.401506 IP 172.20.0.1.50154 > 172.20.0.10.80: Flags [P.], seq 1:914, ack 1, win 512, options [nop,nop,TS val 3671637171 ecr 280999715], length 913: HTTP: GET /_nicegui/3.8.0/components/d05e418f9b14cc45e40f8edb091d7977/header.js HTTP/1.1
[2026-03-06 08:55:54] 1772762152.401559 IP 172.20.0.10.50154 > 172.20.0.30.8080: Flags [P.], seq 1:914, ack 1, win 512, options [nop,nop,TS val 3671637171 ecr 280999715], length 913: HTTP: GET /_nicegui/3.8.0/components/d05e418f9b14cc45e40f8edb091d7977/header.js HTTP/1.1
[2026-03-06 08:55:54] 1772762152.401604 IP 172.20.0.30.8080 > 172.20.0.10.50154: Flags [.], ack 914, win 509, options [nop,nop,TS val 280999724 ecr 3671637171], length 0
[2026-03-06 08:55:54] 1772762152.401609 IP 172.20.0.10.80 > 172.20.0.1.50154: Flags [.], ack 914, win 509, options [nop,nop,TS val 280999724 ecr 3671637171], length 0
[2026-03-06 08:55:54] 1772762152.412844 IP 172.20.0.1.50160 > 172.20.0.10.80: Flags [S], seq 1786305420, win 65495, options [mss 65495,sackOK,TS val 3671637183 ecr 0,nop,wscale 7], length 0
[2026-03-06 08:55:54] 1772762152.412899 IP 172.20.0.10.50160 > 172.20.0.30.8080: Flags [S], seq 1786305420, win 65495, options [mss 65495,sackOK,TS val 3671637183 ecr 0,nop,wscale 7], length 0
[2026-03-06 08:55:54] 1772762152.412956 IP 172.20.0.30.8080 > 172.20.0.10.50160: Flags [S.], seq 1664228386, ack 1786305421, win 65160, options [mss 1460,sackOK,TS val 280999735 ecr 3671637183,nop,wscale 7], length 0
[2026-03-06 08:55:54] 1772762152.412961 IP 172.20.0.10.80 > 172.20.0.1.50160: Flags [S.], seq 1664228386, ack 1786305421, win 65160, options [mss 1460,sackOK,TS val 280999735 ecr 3671637183,nop,wscale 7], length 0
[2026-03-06 08:55:54] 1772762152.412983 IP 172.20.0.1.50160 > 172.20.0.10.80: Flags [.], ack 1, win 512, options [nop,nop,TS val 3671637183 ecr 280999735], length 0
[2026-03-06 08:55:54] 1772762152.412987 IP 172.20.0.10.50160 > 172.20.0.30.8080: Flags [.], ack 1, win 512, options [nop,nop,TS val 3671637183 ecr 280999735], length 0
[2026-03-06 08:55:54] 1772762152.417471 IP 172.20.0.1.50160 > 172.20.0.10.80: Flags [P.], seq 1:891, ack 1, win 512, options [nop,nop,TS val 3671637187 ecr 280999735], length 890: HTTP: GET /_nicegui/3.8.0/static/vue.esm-browser.prod.js HTTP/1.1
[2026-03-06 08:55:54] 1772762152.417522 IP 172.20.0.10.50160 > 172.20.0.30.8080: Flags [P.], seq 1:891, ack 1, win 512, options [nop,nop,TS val 3671637187 ecr 280999735], length 890: HTTP: GET /_nicegui/3.8.0/static/vue.esm-browser.prod.js HTTP/1.1
[2026-03-06 08:55:54] 1772762152.417565 IP 172.20.0.30.8080 > 172.20.0.10.50160: Flags [.], ack 891, win 503, options [nop,nop,TS val 280999740 ecr 3671637187], length 0
[2026-03-06 08:55:54] 1772762152.417570 IP 172.20.0.10.80 > 172.20.0.1.50160: Flags [.], ack 891, win 503, options [nop,nop,TS val 280999740 ecr 3671637187], length 0
[2026-03-06 08:55:54] 1772762152.511940 IP 172.20.0.30.8080 > 172.20.0.10.50122: Flags [P.], seq 4338:4884, ack 1840, win 519, options [nop,nop,TS val 280999834 ecr 3671637144], length 546: HTTP: HTTP/1.1 200 OK
[2026-03-06 08:55:54] 1772762152.512020 IP 172.20.0.10.80 > 172.20.0.1.50122: Flags [P.], seq 4338:4884, ack 1840, win 519, options [nop,nop,TS val 280999834 ecr 3671637144], length 546: HTTP: HTTP/1.1 200 OK
[2026-03-06 08:55:54] 1772762152.512087 IP 172.20.0.1.50122 > 172.20.0.10.80: Flags [.], ack 4884, win 823, options [nop,nop,TS val 3671637282 ecr 280999834], length 0
[2026-03-06 08:55:55] 1772762152.512121 IP 172.20.0.10.50122 > 172.20.0.30.8080: Flags [.], ack 4884, win 823, options [nop,nop,TS val 3671637282 ecr 280999834], length 0
[2026-03-06 08:55:55] 1772762152.513260 IP 172.20.0.30.8080 > 172.20.0.10.50122: Flags [P.], seq 4884:7201, ack 1840, win 519, options [nop,nop,TS val 280999835 ecr 3671637282], length 2317: HTTP
[2026-03-06 08:55:55] 1772762152.513326 IP 172.20.0.10.80 > 172.20.0.1.50122: Flags [P.], seq 4884:7201, ack 1840, win 519, options [nop,nop,TS val 280999835 ecr 3671637282], length 2317: HTTP
[2026-03-06 08:55:55] 1772762152.513384 IP 172.20.0.1.50122 > 172.20.0.10.80: Flags [.], ack 7201, win 812, options [nop,nop,TS val 3671637283 ecr 280999835], length 0
[2026-03-06 08:55:55] 1772762152.513389 IP 172.20.0.10.50122 > 172.20.0.30.8080: Flags [.], ack 7201, win 812, options [nop,nop,TS val 3671637283 ecr 280999835], length 0
[2026-03-06 08:55:55] 1772762152.513429 IP 172.20.0.30.8080 > 172.20.0.10.50130: Flags [P.], seq 1:553, ack 886, win 508, options [nop,nop,TS val 280999835 ecr 3671637148], length 552: HTTP: HTTP/1.1 200 OK
[2026-03-06 08:55:55] 1772762152.513453 IP 172.20.0.10.80 > 172.20.0.1.50130: Flags [P.], seq 1:553, ack 886, win 508, options [nop,nop,TS val 280999835 ecr 3671637148], length 552: HTTP: HTTP/1.1 200 OK
[2026-03-06 08:55:55] 1772762152.513467 IP 172.20.0.1.50130 > 172.20.0.10.80: Flags [.], ack 553, win 508, options [nop,nop,TS val 3671637283 ecr 280999835], length 0
[2026-03-06 08:55:55] 1772762152.513471 IP 172.20.0.10.50130 > 172.20.0.30.8080: Flags [.], ack 553, win 508, options [nop,nop,TS val 3671637283 ecr 280999835], length 0
[2026-03-06 08:55:55] 1772762152.514618 IP 172.20.0.30.8080 > 172.20.0.10.50130: Flags [P.], seq 553:568, ack 886, win 508, options [nop,nop,TS val 280999837 ecr 3671637283], length 15: HTTP
[2026-03-06 08:55:55] 1772762152.514668 IP 172.20.0.10.80 > 172.20.0.1.50130: Flags [P.], seq 553:568, ack 886, win 508, options [nop,nop,TS val 280999837 ecr 3671637283], length 15: HTTP
[2026-03-06 08:55:55] 1772762152.514727 IP 172.20.0.1.50130 > 172.20.0.10.80: Flags [.], ack 568, win 508, options [nop,nop,TS val 3671637285 ecr 280999837], length 0
[2026-03-06 08:55:55] 1772762152.514732 IP 172.20.0.10.50130 > 172.20.0.30.8080: Flags [.], ack 568, win 508, options [nop,nop,TS val 3671637285 ecr 280999837], length 0
[2026-03-06 08:55:55] 1772762152.516869 IP 172.20.0.30.8080 > 172.20.0.10.50154: Flags [P.], seq 1:506, ack 914, win 510, options [nop,nop,TS val 280999839 ecr 3671637171], length 505: HTTP: HTTP/1.1 200 OK
[2026-03-06 08:55:55] 1772762152.516922 IP 172.20.0.10.80 > 172.20.0.1.50154: Flags [P.], seq 1:506, ack 914, win 510, options [nop,nop,TS val 280999839 ecr 3671637171], length 505: HTTP: HTTP/1.1 200 OK
[2026-03-06 08:55:55] 1772762152.516954 IP 172.20.0.1.50154 > 172.20.0.10.80: Flags [.], ack 506, win 509, options [nop,nop,TS val 3671637287 ecr 280999839], length 0
[2026-03-06 08:55:55] 1772762152.516959 IP 172.20.0.10.50154 > 172.20.0.30.8080: Flags [.], ack 506, win 509, options [nop,nop,TS val 3671637287 ecr 280999839], length 0
[2026-03-06 08:55:55] 1772762152.517378 IP 172.20.0.30.8080 > 172.20.0.10.50154: Flags [P.], seq 506:923, ack 914, win 510, options [nop,nop,TS val 280999839 ecr 3671637287], length 417: HTTP
[2026-03-06 08:55:55] 1772762152.517416 IP 172.20.0.10.80 > 172.20.0.1.50154: Flags [P.], seq 506:923, ack 914, win 510, options [nop,nop,TS val 280999839 ecr 3671637287], length 417: HTTP
[2026-03-06 08:55:55] 1772762152.517460 IP 172.20.0.1.50154 > 172.20.0.10.80: Flags [.], ack 923, win 507, options [nop,nop,TS val 3671637287 ecr 280999839], length 0
[2026-03-06 08:55:55] 1772762152.517465 IP 172.20.0.10.50154 > 172.20.0.30.8080: Flags [.], ack 923, win 507, options [nop,nop,TS val 3671637287 ecr 280999839], length 0
[2026-03-06 08:55:55] 1772762152.547046 IP 172.20.0.1.50122 > 172.20.0.10.80: Flags [P.], seq 1840:2751, ack 7201, win 823, options [nop,nop,TS val 3671637316 ecr 280999835], length 911: HTTP: GET /_nicegui/3.8.0/components/15c9c55268e7c29ac06fc3a661a60377/link.js HTTP/1.1
[2026-03-06 08:55:55] 1772762152.547114 IP 172.20.0.10.50122 > 172.20.0.30.8080: Flags [P.], seq 1840:2751, ack 7201, win 823, options [nop,nop,TS val 3671637316 ecr 280999835], length 911: HTTP: GET /_nicegui/3.8.0/components/15c9c55268e7c29ac06fc3a661a60377/link.js HTTP/1.1
[2026-03-06 08:55:55] 1772762152.547169 IP 172.20.0.30.8080 > 172.20.0.10.50122: Flags [.], ack 2751, win 512, options [nop,nop,TS val 280999869 ecr 3671637316], length 0
[2026-03-06 08:55:55] 1772762152.547175 IP 172.20.0.10.80 > 172.20.0.1.50122: Flags [.], ack 2751, win 512, options [nop,nop,TS val 280999869 ecr 3671637316], length 0
[2026-03-06 08:55:55] 1772762152.555348 IP 172.20.0.30.8080 > 172.20.0.10.50138: Flags [P.], seq 1:547, ack 884, win 508, options [nop,nop,TS val 280999877 ecr 3671637156], length 546: HTTP: HTTP/1.1 200 OK
[2026-03-06 08:55:55] 1772762152.555373 IP 172.20.0.10.80 > 172.20.0.1.50138: Flags [P.], seq 1:547, ack 884, win 508, options [nop,nop,TS val 280999877 ecr 3671637156], length 546: HTTP: HTTP/1.1 200 OK
[2026-03-06 08:55:55] 1772762152.555454 IP 172.20.0.1.50138 > 172.20.0.10.80: Flags [.], ack 547, win 508, options [nop,nop,TS val 3671637325 ecr 280999877], length 0
[2026-03-06 08:55:55] 1772762152.555461 IP 172.20.0.10.50138 > 172.20.0.30.8080: Flags [.], ack 547, win 508, options [nop,nop,TS val 3671637325 ecr 280999877], length 0
[2026-03-06 08:55:56] 1772762152.555516 IP 172.20.0.30.8080 > 172.20.0.10.50142: Flags [P.], seq 1:547, ack 870, win 504, options [nop,nop,TS val 280999878 ecr 3671637160], length 546: HTTP: HTTP/1.1 200 OK
[2026-03-06 08:55:56] 1772762152.555521 IP 172.20.0.10.80 > 172.20.0.1.50142: Flags [P.], seq 1:547, ack 870, win 504, options [nop,nop,TS val 280999878 ecr 3671637160], length 546: HTTP: HTTP/1.1 200 OK
[2026-03-06 08:55:56] 1772762152.555535 IP 172.20.0.1.50142 > 172.20.0.10.80: Flags [.], ack 547, win 508, options [nop,nop,TS val 3671637326 ecr 280999878], length 0
[2026-03-06 08:55:56] 1772762152.555538 IP 172.20.0.10.50142 > 172.20.0.30.8080: Flags [.], ack 547, win 508, options [nop,nop,TS val 3671637326 ecr 280999878], length 0
[2026-03-06 08:55:56] 1772762152.557195 IP 172.20.0.30.8080 > 172.20.0.10.50160: Flags [P.], seq 1:560, ack 891, win 508, options [nop,nop,TS val 280999879 ecr 3671637187], length 559: HTTP: HTTP/1.1 200 OK
[2026-03-06 08:55:56] 1772762152.557249 IP 172.20.0.10.80 > 172.20.0.1.50160: Flags [P.], seq 1:560, ack 891, win 508, options [nop,nop,TS val 280999879 ecr 3671637187], length 559: HTTP: HTTP/1.1 200 OK
[2026-03-06 08:55:56] 1772762152.557319 IP 172.20.0.1.50160 > 172.20.0.10.80: Flags [.], ack 560, win 508, options [nop,nop,TS val 3671637327 ecr 280999879], length 0
[2026-03-06 08:55:56] 1772762152.557349 IP 172.20.0.10.50160 > 172.20.0.30.8080: Flags [.], ack 560, win 508, options [nop,nop,TS val 3671637327 ecr 280999879], length 0
[2026-03-06 08:55:56] 1772762152.557453 IP 172.20.0.30.8080 > 172.20.0.10.50138: Flags [P.], seq 547:7787, ack 884, win 508, options [nop,nop,TS val 280999879 ecr 3671637325], length 7240: HTTP
[2026-03-06 08:55:56] 1772762152.557512 IP 172.20.0.10.80 > 172.20.0.1.50138: Flags [P.], seq 547:7787, ack 884, win 508, options [nop,nop,TS val 280999879 ecr 3671637325], length 7240: HTTP
[2026-03-06 08:55:56] 1772762152.557562 IP 172.20.0.1.50138 > 172.20.0.10.80: Flags [.], ack 7787, win 852, options [nop,nop,TS val 3671637328 ecr 280999879], length 0
[2026-03-06 08:55:56] 1772762152.557567 IP 172.20.0.10.50138 > 172.20.0.30.8080: Flags [.], ack 7787, win 852, options [nop,nop,TS val 3671637328 ecr 280999879], length 0
[2026-03-06 08:55:56] 1772762152.557585 IP 172.20.0.30.8080 > 172.20.0.10.50138: Flags [P.], seq 7787:7852, ack 884, win 508, options [nop,nop,TS val 280999879 ecr 3671637325], length 65: HTTP
[2026-03-06 08:55:56] 1772762152.557589 IP 172.20.0.10.80 > 172.20.0.1.50138: Flags [P.], seq 7787:7852, ack 884, win 508, options [nop,nop,TS val 280999879 ecr 3671637325], length 65: HTTP
[2026-03-06 08:55:56] 1772762152.557598 IP 172.20.0.1.50138 > 172.20.0.10.80: Flags [.], ack 7852, win 852, options [nop,nop,TS val 3671637328 ecr 280999879], length 0
[2026-03-06 08:55:56] 1772762152.557601 IP 172.20.0.10.50138 > 172.20.0.30.8080: Flags [.], ack 7852, win 852, options [nop,nop,TS val 3671637328 ecr 280999879], length 0
[2026-03-06 08:55:56] 1772762152.557631 IP 172.20.0.30.8080 > 172.20.0.10.50142: Flags [P.], seq 547:2532, ack 870, win 504, options [nop,nop,TS val 280999880 ecr 3671637326], length 1985: HTTP
[2026-03-06 08:55:56] 1772762152.557637 IP 172.20.0.10.80 > 172.20.0.1.50142: Flags [P.], seq 547:2532, ack 870, win 504, options [nop,nop,TS val 280999880 ecr 3671637326], length 1985: HTTP
[2026-03-06 08:55:56] 1772762152.557649 IP 172.20.0.1.50142 > 172.20.0.10.80: Flags [.], ack 2532, win 689, options [nop,nop,TS val 3671637328 ecr 280999880], length 0
[2026-03-06 08:55:57] 1772762152.557652 IP 172.20.0.10.50142 > 172.20.0.30.8080: Flags [.], ack 2532, win 689, options [nop,nop,TS val 3671637328 ecr 280999880], length 0
[2026-03-06 08:55:57] 1772762152.570712 IP 172.20.0.30.8080 > 172.20.0.10.50160: Flags [P.], seq 560:7800, ack 891, win 508, options [nop,nop,TS val 280999893 ecr 3671637327], length 7240: HTTP
[2026-03-06 08:55:57] 1772762152.570795 IP 172.20.0.10.80 > 172.20.0.1.50160: Flags [P.], seq 560:7800, ack 891, win 508, options [nop,nop,TS val 280999893 ecr 3671637327], length 7240: HTTP
[2026-03-06 08:55:57] 1772762152.572257 IP 172.20.0.1.50160 > 172.20.0.10.80: Flags [.], ack 7800, win 852, options [nop,nop,TS val 3671637342 ecr 280999893], length 0
[2026-03-06 08:55:57] 1772762152.588386 IP 172.20.0.10.50160 > 172.20.0.30.8080: Flags [.], ack 7800, win 852, options [nop,nop,TS val 3671637342 ecr 280999893], length 0
[2026-03-06 08:55:57] 1772762152.589427 IP 172.20.0.30.8080 > 172.20.0.10.50160: Flags [P.], seq 7800:15040, ack 891, win 508, options [nop,nop,TS val 280999893 ecr 3671637327], length 7240: HTTP
[2026-03-06 08:55:57] 1772762152.589542 IP 172.20.0.10.80 > 172.20.0.1.50160: Flags [P.], seq 7800:15040, ack 891, win 508, options [nop,nop,TS val 280999893 ecr 3671637327], length 7240: HTTP
[2026-03-06 08:55:57] 1772762152.589681 IP 172.20.0.1.50160 > 172.20.0.10.80: Flags [.], ack 15040, win 852, options [nop,nop,TS val 3671637360 ecr 280999893], length 0
[2026-03-06 08:55:57] 1772762152.589715 IP 172.20.0.10.50160 > 172.20.0.30.8080: Flags [.], ack 15040, win 852, options [nop,nop,TS val 3671637360 ecr 280999893], length 0
[2026-03-06 08:55:57] 1772762152.589823 IP 172.20.0.30.8080 > 172.20.0.10.50160: Flags [P.], seq 15040:25176, ack 891, win 508, options [nop,nop,TS val 280999912 ecr 3671637342], length 10136: HTTP
[2026-03-06 08:55:57] 1772762152.589916 IP 172.20.0.10.80 > 172.20.0.1.50160: Flags [P.], seq 15040:25176, ack 891, win 508, options [nop,nop,TS val 280999912 ecr 3671637342], length 10136: HTTP
[2026-03-06 08:55:57] 1772762152.589976 IP 172.20.0.1.50160 > 172.20.0.10.80: Flags [.], ack 25176, win 832, options [nop,nop,TS val 3671637360 ecr 280999912], length 0
[2026-03-06 08:55:57] 1772762152.589981 IP 172.20.0.10.50160 > 172.20.0.30.8080: Flags [.], ack 25176, win 832, options [nop,nop,TS val 3671637360 ecr 280999912], length 0
[2026-03-06 08:55:57] 1772762152.589998 IP 172.20.0.30.8080 > 172.20.0.10.50160: Flags [P.], seq 25176:25748, ack 891, win 508, options [nop,nop,TS val 280999912 ecr 3671637342], length 572: HTTP
[2026-03-06 08:55:57] 1772762152.590003 IP 172.20.0.10.80 > 172.20.0.1.50160: Flags [P.], seq 25176:25748, ack 891, win 508, options [nop,nop,TS val 280999912 ecr 3671637342], length 572: HTTP
[2026-03-06 08:55:57] 1772762152.590030 IP 172.20.0.1.50160 > 172.20.0.10.80: Flags [.], ack 25748, win 888, options [nop,nop,TS val 3671637360 ecr 280999912], length 0
[2026-03-06 08:55:57] 1772762152.590042 IP 172.20.0.10.50160 > 172.20.0.30.8080: Flags [.], ack 25748, win 888, options [nop,nop,TS val 3671637360 ecr 280999912], length 0
[2026-03-06 08:55:57] 1772762152.616959 IP 172.20.0.30.8080 > 172.20.0.10.50130: Flags [P.], seq 568:7808, ack 886, win 508, options [nop,nop,TS val 280999939 ecr 3671637285], length 7240: HTTP
[2026-03-06 08:55:57] 1772762152.617051 IP 172.20.0.10.80 > 172.20.0.1.50130: Flags [P.], seq 568:7808, ack 886, win 508, options [nop,nop,TS val 280999939 ecr 3671637285], length 7240: HTTP
[2026-03-06 08:55:57] 1772762152.617140 IP 172.20.0.1.50130 > 172.20.0.10.80: Flags [.], ack 7808, win 852, options [nop,nop,TS val 3671637387 ecr 280999939], length 0
[2026-03-06 08:55:57] 1772762152.617147 IP 172.20.0.10.50130 > 172.20.0.30.8080: Flags [.], ack 7808, win 852, options [nop,nop,TS val 3671637387 ecr 280999939], length 0
[2026-03-06 08:55:57] 1772762152.617177 IP 172.20.0.30.8080 > 172.20.0.10.50130: Flags [P.], seq 7808:15048, ack 886, win 508, options [nop,nop,TS val 280999939 ecr 3671637285], length 7240: HTTP
[2026-03-06 08:55:57] 1772762152.617181 IP 172.20.0.10.80 > 172.20.0.1.50130: Flags [P.], seq 7808:15048, ack 886, win 508, options [nop,nop,TS val 280999939 ecr 3671637285], length 7240: HTTP
[2026-03-06 08:55:57] 1772762152.617193 IP 172.20.0.1.50130 > 172.20.0.10.80: Flags [.], ack 15048, win 802, options [nop,nop,TS val 3671637387 ecr 280999939], length 0
[2026-03-06 08:55:57] 1772762152.617196 IP 172.20.0.10.50130 > 172.20.0.30.8080: Flags [.], ack 15048, win 802, options [nop,nop,TS val 3671637387 ecr 280999939], length 0
[2026-03-06 08:55:57] 1772762152.617282 IP 172.20.0.30.8080 > 172.20.0.10.50130: Flags [P.], seq 15048:29528, ack 886, win 508, options [nop,nop,TS val 280999939 ecr 3671637387], length 14480: HTTP
[2026-03-06 08:55:57] 1772762152.617366 IP 172.20.0.10.80 > 172.20.0.1.50130: Flags [P.], seq 15048:29528, ack 886, win 508, options [nop,nop,TS val 280999939 ecr 3671637387], length 14480: HTTP
[2026-03-06 08:55:57] 1772762152.617429 IP 172.20.0.1.50130 > 172.20.0.10.80: Flags [.], ack 29528, win 802, options [nop,nop,TS val 3671637387 ecr 280999939], length 0
[2026-03-06 08:55:57] 1772762152.617456 IP 172.20.0.10.50130 > 172.20.0.30.8080: Flags [.], ack 29528, win 802, options [nop,nop,TS val 3671637387 ecr 280999939], length 0
[2026-03-06 08:55:57] 1772762152.617474 IP 172.20.0.30.8080 > 172.20.0.10.50130: Flags [P.], seq 29528:30658, ack 886, win 508, options [nop,nop,TS val 280999939 ecr 3671637387], length 1130: HTTP
[2026-03-06 08:55:58] 1772762152.617478 IP 172.20.0.10.80 > 172.20.0.1.50130: Flags [P.], seq 29528:30658, ack 886, win 508, options [nop,nop,TS val 280999939 ecr 3671637387], length 1130: HTTP
[2026-03-06 08:55:58] 1772762152.617489 IP 172.20.0.1.50130 > 172.20.0.10.80: Flags [.], ack 30658, win 794, options [nop,nop,TS val 3671637388 ecr 280999939], length 0
[2026-03-06 08:55:58] 1772762152.617492 IP 172.20.0.10.50130 > 172.20.0.30.8080: Flags [.], ack 30658, win 794, options [nop,nop,TS val 3671637388 ecr 280999939], length 0
[2026-03-06 08:55:58] 1772762152.633154 IP 172.20.0.30.8080 > 172.20.0.10.50160: Flags [P.], seq 25748:46020, ack 891, win 508, options [nop,nop,TS val 280999955 ecr 3671637360], length 20272: HTTP
[2026-03-06 08:55:58] 1772762152.633263 IP 172.20.0.10.80 > 172.20.0.1.50160: Flags [P.], seq 25748:46020, ack 891, win 508, options [nop,nop,TS val 280999955 ecr 3671637360], length 20272: HTTP
[2026-03-06 08:55:58] 1772762152.633377 IP 172.20.0.1.50160 > 172.20.0.10.80: Flags [.], ack 46020, win 762, options [nop,nop,TS val 3671637403 ecr 280999955], length 0
[2026-03-06 08:55:58] 1772762152.633407 IP 172.20.0.10.50160 > 172.20.0.30.8080: Flags [.], ack 46020, win 762, options [nop,nop,TS val 3671637403 ecr 280999955], length 0
[2026-03-06 08:55:58] 1772762152.641462 IP 172.20.0.30.8080 > 172.20.0.10.50160: Flags [P.], seq 46020:60761, ack 891, win 508, options [nop,nop,TS val 280999955 ecr 3671637360], length 14741: HTTP
[2026-03-06 08:55:58] 1772762152.644269 IP 172.20.0.10.80 > 172.20.0.1.50160: Flags [P.], seq 46020:60761, ack 891, win 508, options [nop,nop,TS val 280999955 ecr 3671637360], length 14741: HTTP
[2026-03-06 08:55:58] 1772762152.644475 IP 172.20.0.1.50160 > 172.20.0.10.80: Flags [.], ack 60761, win 800, options [nop,nop,TS val 3671637414 ecr 280999955], length 0
[2026-03-06 08:55:58] 1772762152.644565 IP 172.20.0.10.50160 > 172.20.0.30.8080: Flags [.], ack 60761, win 800, options [nop,nop,TS val 3671637414 ecr 280999955], length 0
[2026-03-06 08:55:58] 1772762152.644781 IP 172.20.0.30.8080 > 172.20.0.10.50130: Flags [P.], seq 30658:33171, ack 886, win 508, options [nop,nop,TS val 280999967 ecr 3671637388], length 2513: HTTP
[2026-03-06 08:55:58] 1772762152.644799 IP 172.20.0.10.80 > 172.20.0.1.50130: Flags [P.], seq 30658:33171, ack 886, win 508, options [nop,nop,TS val 280999967 ecr 3671637388], length 2513: HTTP
[2026-03-06 08:55:58] 1772762152.644904 IP 172.20.0.1.50130 > 172.20.0.10.80: Flags [.], ack 33171, win 885, options [nop,nop,TS val 3671637415 ecr 280999967], length 0
[2026-03-06 08:55:58] 1772762152.644917 IP 172.20.0.10.50130 > 172.20.0.30.8080: Flags [.], ack 33171, win 885, options [nop,nop,TS val 3671637415 ecr 280999967], length 0
[2026-03-06 08:55:58] 1772762152.646137 IP 172.20.0.30.8080 > 172.20.0.10.50160: Flags [P.], seq 60761:60766, ack 891, win 508, options [nop,nop,TS val 280999968 ecr 3671637414], length 5: HTTP
[2026-03-06 08:55:58] 1772762152.646158 IP 172.20.0.10.80 > 172.20.0.1.50160: Flags [P.], seq 60761:60766, ack 891, win 508, options [nop,nop,TS val 280999968 ecr 3671637414], length 5: HTTP
[2026-03-06 08:55:58] 1772762152.646228 IP 172.20.0.1.50160 > 172.20.0.10.80: Flags [.], ack 60766, win 888, options [nop,nop,TS val 3671637416 ecr 280999968], length 0
[2026-03-06 08:55:58] 1772762152.646234 IP 172.20.0.10.50160 > 172.20.0.30.8080: Flags [.], ack 60766, win 888, options [nop,nop,TS val 3671637416 ecr 280999968], length 0
[2026-03-06 08:55:58] 1772762152.646275 IP 172.20.0.30.8080 > 172.20.0.10.50130: Flags [P.], seq 33171:33176, ack 886, win 508, options [nop,nop,TS val 280999968 ecr 3671637415], length 5: HTTP
[2026-03-06 08:55:58] 1772762152.646279 IP 172.20.0.10.80 > 172.20.0.1.50130: Flags [P.], seq 33171:33176, ack 886, win 508, options [nop,nop,TS val 280999968 ecr 3671637415], length 5: HTTP
[2026-03-06 08:55:58] 1772762152.646292 IP 172.20.0.1.50130 > 172.20.0.10.80: Flags [.], ack 33176, win 885, options [nop,nop,TS val 3671637416 ecr 280999968], length 0
[2026-03-06 08:55:58] 1772762152.646295 IP 172.20.0.10.50130 > 172.20.0.30.8080: Flags [.], ack 33176, win 885, options [nop,nop,TS val 3671637416 ecr 280999968], length 0
[2026-03-06 08:55:58] 1772762152.650449 IP 172.20.0.30.8080 > 172.20.0.10.50122: Flags [P.], seq 7201:7753, ack 2751, win 512, options [nop,nop,TS val 280999972 ecr 3671637316], length 552: HTTP: HTTP/1.1 200 OK
[2026-03-06 08:55:58] 1772762152.650473 IP 172.20.0.10.80 > 172.20.0.1.50122: Flags [P.], seq 7201:7753, ack 2751, win 512, options [nop,nop,TS val 280999972 ecr 3671637316], length 552: HTTP: HTTP/1.1 200 OK
[2026-03-06 08:55:58] 1772762152.650519 IP 172.20.0.1.50122 > 172.20.0.10.80: Flags [.], ack 7753, win 823, options [nop,nop,TS val 3671637421 ecr 280999972], length 0
[2026-03-06 08:55:58] 1772762152.650524 IP 172.20.0.10.50122 > 172.20.0.30.8080: Flags [.], ack 7753, win 823, options [nop,nop,TS val 3671637421 ecr 280999972], length 0
[2026-03-06 08:55:58] 1772762152.651190 IP 172.20.0.30.8080 > 172.20.0.10.50122: Flags [P.], seq 7753:8044, ack 2751, win 512, options [nop,nop,TS val 280999973 ecr 3671637421], length 291: HTTP
[2026-03-06 08:55:58] 1772762152.651208 IP 172.20.0.10.80 > 172.20.0.1.50122: Flags [P.], seq 7753:8044, ack 2751, win 512, options [nop,nop,TS val 280999973 ecr 3671637421], length 291: HTTP
[2026-03-06 08:55:58] 1772762152.651235 IP 172.20.0.1.50122 > 172.20.0.10.80: Flags [.], ack 8044, win 821, options [nop,nop,TS val 3671637421 ecr 280999973], length 0
[2026-03-06 08:55:58] 1772762152.651239 IP 172.20.0.10.50122 > 172.20.0.30.8080: Flags [.], ack 8044, win 821, options [nop,nop,TS val 3671637421 ecr 280999973], length 0
[2026-03-06 08:55:58] 1772762152.663343 IP 172.20.0.1.50122 > 172.20.0.10.80: Flags [P.], seq 2751:3611, ack 8044, win 823, options [nop,nop,TS val 3671637433 ecr 280999973], length 860: HTTP: GET /_nicegui/3.8.0/static/socket.io.min.js HTTP/1.1
[2026-03-06 08:55:58] 1772762152.663395 IP 172.20.0.10.50122 > 172.20.0.30.8080: Flags [P.], seq 2751:3611, ack 8044, win 823, options [nop,nop,TS val 3671637433 ecr 280999973], length 860: HTTP: GET /_nicegui/3.8.0/static/socket.io.min.js HTTP/1.1
[2026-03-06 08:55:59] 1772762152.663469 IP 172.20.0.30.8080 > 172.20.0.10.50122: Flags [.], ack 3611, win 506, options [nop,nop,TS val 280999985 ecr 3671637433], length 0
[2026-03-06 08:55:59] 1772762152.663476 IP 172.20.0.10.80 > 172.20.0.1.50122: Flags [.], ack 3611, win 506, options [nop,nop,TS val 280999985 ecr 3671637433], length 0
[2026-03-06 08:55:59] 1772762152.665140 IP 172.20.0.1.50130 > 172.20.0.10.80: Flags [P.], seq 886:1748, ack 33176, win 885, options [nop,nop,TS val 3671637435 ecr 280999968], length 862: HTTP: GET /_nicegui/3.8.0/static/tailwindcss.min.js HTTP/1.1
[2026-03-06 08:55:59] 1772762152.665193 IP 172.20.0.10.50130 > 172.20.0.30.8080: Flags [P.], seq 886:1748, ack 33176, win 885, options [nop,nop,TS val 3671637435 ecr 280999968], length 862: HTTP: GET /_nicegui/3.8.0/static/tailwindcss.min.js HTTP/1.1
[2026-03-06 08:55:59] 1772762152.665241 IP 172.20.0.30.8080 > 172.20.0.10.50130: Flags [.], ack 1748, win 502, options [nop,nop,TS val 280999987 ecr 3671637435], length 0
[2026-03-06 08:55:59] 1772762152.665246 IP 172.20.0.10.80 > 172.20.0.1.50130: Flags [.], ack 1748, win 502, options [nop,nop,TS val 280999987 ecr 3671637435], length 0
[2026-03-06 08:55:59] 1772762152.679590 IP 172.20.0.1.50142 > 172.20.0.10.80: Flags [P.], seq 870:1724, ack 2532, win 689, options [nop,nop,TS val 3671637450 ecr 280999880], length 854: HTTP: GET /_nicegui/3.8.0/static/nicegui.js HTTP/1.1
[2026-03-06 08:55:59] 1772762152.679662 IP 172.20.0.10.50142 > 172.20.0.30.8080: Flags [P.], seq 870:1724, ack 2532, win 689, options [nop,nop,TS val 3671637450 ecr 280999880], length 854: HTTP: GET /_nicegui/3.8.0/static/nicegui.js HTTP/1.1
[2026-03-06 08:55:59] 1772762152.679744 IP 172.20.0.30.8080 > 172.20.0.10.50142: Flags [.], ack 1724, win 498, options [nop,nop,TS val 281000002 ecr 3671637450], length 0
[2026-03-06 08:55:59] 1772762152.679750 IP 172.20.0.10.80 > 172.20.0.1.50142: Flags [.], ack 1724, win 498, options [nop,nop,TS val 281000002 ecr 3671637450], length 0
[2026-03-06 08:55:59] 1772762152.679837 IP 172.20.0.1.50160 > 172.20.0.10.80: Flags [P.], seq 891:1753, ack 60766, win 888, options [nop,nop,TS val 3671637450 ecr 280999968], length 862: HTTP: GET /_nicegui/3.8.0/static/quasar.umd.prod.js HTTP/1.1
[2026-03-06 08:55:59] 1772762152.679876 IP 172.20.0.10.50160 > 172.20.0.30.8080: Flags [P.], seq 891:1753, ack 60766, win 888, options [nop,nop,TS val 3671637450 ecr 280999968], length 862: HTTP: GET /_nicegui/3.8.0/static/quasar.umd.prod.js HTTP/1.1
[2026-03-06 08:55:59] 1772762152.679936 IP 172.20.0.30.8080 > 172.20.0.10.50160: Flags [.], ack 1753, win 502, options [nop,nop,TS val 281000002 ecr 3671637450], length 0
[2026-03-06 08:55:59] 1772762152.679967 IP 172.20.0.10.80 > 172.20.0.1.50160: Flags [.], ack 1753, win 502, options [nop,nop,TS val 281000002 ecr 3671637450], length 0
[2026-03-06 08:55:59] 1772762152.680194 IP 172.20.0.1.50138 > 172.20.0.10.80: Flags [P.], seq 884:1750, ack 7852, win 852, options [nop,nop,TS val 3671637450 ecr 280999879], length 866: HTTP: GET /_nicegui/3.8.0/static/lang/en-US.umd.prod.js HTTP/1.1
[2026-03-06 08:55:59] 1772762152.680317 IP 172.20.0.10.50138 > 172.20.0.30.8080: Flags [P.], seq 884:1750, ack 7852, win 852, options [nop,nop,TS val 3671637450 ecr 280999879], length 866: HTTP: GET /_nicegui/3.8.0/static/lang/en-US.umd.prod.js HTTP/1.1
[2026-03-06 08:55:59] 1772762152.680347 IP 172.20.0.30.8080 > 172.20.0.10.50138: Flags [.], ack 1750, win 502, options [nop,nop,TS val 281000002 ecr 3671637450], length 0
[2026-03-06 08:55:59] 1772762152.680352 IP 172.20.0.10.80 > 172.20.0.1.50138: Flags [.], ack 1750, win 502, options [nop,nop,TS val 281000002 ecr 3671637450], length 0
[2026-03-06 08:55:59] 1772762152.711713 IP 172.20.0.30.8080 > 172.20.0.10.50122: Flags [P.], seq 8044:8598, ack 3611, win 506, options [nop,nop,TS val 281000034 ecr 3671637433], length 554: HTTP: HTTP/1.1 200 OK
[2026-03-06 08:55:59] 1772762152.711772 IP 172.20.0.10.80 > 172.20.0.1.50122: Flags [P.], seq 8044:8598, ack 3611, win 506, options [nop,nop,TS val 281000034 ecr 3671637433], length 554: HTTP: HTTP/1.1 200 OK
[2026-03-06 08:55:59] 1772762152.726543 IP 172.20.0.30.8080 > 172.20.0.10.50122: Flags [P.], seq 8598:15838, ack 3611, win 506, options [nop,nop,TS val 281000039 ecr 3671637433], length 7240: HTTP
[2026-03-06 08:55:59] 1772762152.726719 IP 172.20.0.10.80 > 172.20.0.1.50122: Flags [P.], seq 8598:15838, ack 3611, win 506, options [nop,nop,TS val 281000039 ecr 3671637433], length 7240: HTTP
[2026-03-06 08:55:59] 1772762152.726880 IP 172.20.0.1.50122 > 172.20.0.10.80: Flags [.], ack 15838, win 823, options [nop,nop,TS val 3671637497 ecr 281000034], length 0
